chunk_id,window_start,window_end,text,binary_hit
54,1:48:00,1:50:00,"[01:48:00–01:48:30]
You know, maybe we don't wait ten years before we do certain things. Maybe we do a smaller, you
know, middle school only bond or high school only bond, and then in two to three years we do
another. I mean, maybe we just don't do a billion and a half at a time. I mean, I don't know. That
that's certainly a consideration. That's if Austin does something that's going to be adverse to our
tax base. Um, it's not a bad point. I just I don't think that we can can not do something and stay
paralyzed.

[01:48:30–01:49:00]
because those clowns are, you know, we don't know what they're gonna do. I mean, they change their
mind every other day. So well, and again, I'll go back to the thing. I I don't think anybody's ever
looked at our athletic facilities and asked for an assessment. And they're in desperate, they're in
desperate need of attention, and I don't think it's ever been done. So again, I I've said it in the
last few meetings. Our job, at least as facilities, is to identify needs, and I don't think I've

[01:49:00–01:49:30]
ever heard anyone ever talk about the athletic facilities. I've heard talk about the middle schools
and the other half of Memorial and Springwood. I've never heard a single person ever mention
athletic facilities in bond planning, ever. And so, you know, it it needs to be done. And at the end
of the day, we're not spending the money. All we're doing is identifying a need. We're falling way
behind people that we're competing with for students, and we're falling behind the rest of the
state, and we're putting it to community to vote for it. And if if the majority

[01:49:30–01:50:00]
of the community is not in favor of doing this, then then we're not in favor of doing it. But I
think it's something that we should put to our voters because I don't think it's ever been put to
them before. So I mean it'll be very, very interesting to see how it does. And it's all we're doing
is raising awareness and presenting what we feel like is a need. So we'll continue. Continuing the
central facilities, Reggie Group Stadium, um aerial, no ch noted changes to limitations and
considerations.",0
55,1:50:00,1:52:00,"[01:50:00–01:50:30]
Grobe remains a decision between option B and option C. So we're showing you again scenario two.
Option B included the 5,000 seats, the rebuild of Grobe Stadium, which included the buildings on the
west side, the new athletic field house, the new paving, the new synthetic turf, and new parking
around the facility. Option C was a rebuild, but took it one step farther to replace the buildings
and the bleachers on the east side, increasing the capacity to 5,500 and ultimately rebuilding.

[01:51:00–01:51:30]
everything out there. We have removed option A, which was renovation of the existing, and wanted to
show you the updated scope comparison. Again, option C includes everything that had been included in
B and adds that east side, visitor bleachers, and buildings. We are carrying in scenario three the
option C of the full rebuild of Grobe at 44.5. New natatorium in scenario three. The program has
remained the same.

[01:51:30–01:52:00]
The floor plan and the concept of what we were including has stayed the same. Your existing location
of the high schools and the existing location of the WWM's natatorium being at Spring Woods, shown
for context. Natatorium site location one that we looked at as a viable site adjacent to
Westchester. Location two, adjacent to the Vines Science Center off of Westview, next to Grove.
Location three, north of Cedar Brook Elementary at the transition campus.",0
56,1:52:00,1:54:00,"[01:52:00–01:52:30]
And we have brought forward tonight uh site location four, which was discussed uh previously, but is
shown graphically at Tully Stadium. So the north end of the site at Tully is currently at grade
detention ponds. Those could be infilled to provide for new parking. That building, again at the
same program square footage that we've shown before, will fit on that site north of Tully. We've
shown a new entry, main entrance on the southwest corner, the size of the pool building configured
east to west, and then support parking. So when

[01:52:30–01:53:00]
you place that building on that site, you will lose some parking. We have illustrated here that
there is a net impact of spaces gained of 100 spots. So it is a viable site for consideration. Can I
ask a quick question? Paige, this might be for you. Do you have any concern about the first two when
you're looking at locations being in a neighborhood and traffic as far as swim meets and that kind
of stuff? And a morning practice would be different, but for big events. Just like your natatorium,
yes.

[01:53:00–01:53:30]
Yes. Yes, I I do. I I'm concerned about that. And um I think this is why, for example, uh, you know,
looking at the natatorium there at Tully, I think um, you know, um uh John asked about um you know
about the possibility of leaving it at Springwoods, like if the it could be built larger. I think
one of the things probably people don't know is you know really that we ra actually have a parking
problem there and really that is where the band marches. And so what we do the entire water polo
season and you know water polo overlaps with swimming is that we block off the the park.

[01:53:30–01:54:00]
off the the parking lot for the band and so even though so so we really park in the field house
parking lot and tell everybody you can't park in the natatorium parking lot and you've got to walk
you know walk through please don't you know please don't walk through the band walk around and so
really that whole parking lot we we don't we don't use because that's for the band through you know
kind of through November and really so then again you have to remember like this is like two pools
now not one pool that the the new natatorium would be so you want to just make sure that we have you
know enough parking because we we plan to use it and",0
57,1:54:00,1:56:00,"[01:54:00–01:54:30]
we believe that, you know, you know, if we if you build it, you know, we'll come it'll c you know,
people will come and and we will, you know, we'll use it um to so I think I mean I certainly I know
there are lots of thoughts about where it should be in terms of whether it needs to be uh centrally
located. I think uh this was just one thought that um again about perhaps that because I think there
might be uh a number of times we're not necessarily looking you know using that north parking area.
Yeah.

[01:54:30–01:55:00]
So the concept here shown cites the natatorium at the north north of Tully and illustrates
everything that could occur at the complex. I flipped ahead too far, but so um shown on this slide
is with Stratford option A, the softball remaining in the in the location it currently exists behind
Don Coleman, the additions at Don Coleman with the security vestibules, the addition at the athletic
central facility building, the rebuild of Tully, and then the natatorium to show that this.

[01:55:30–01:56:00]
is a viable site for all of those. The second option is with Stratford High School option B. If that
softball field were to be relocated to any location, that would free up the southeast corner of the
site behind Don Coleman and provide space for approximately 330 more spaces. This is an advantage
when you look at Don Coleman with that package because we're adding the secure vestibules and the
entries, the additions on both sides. Currently, that space on the right side of the plan is
occupied by softball and not available for parking.",0
58,1:56:00,1:58:00,"[01:56:00–01:56:30]
so this would just provide more of a symmetrical, you know, additional expanded parking to access
that building from both sides. But again, it works with either option at Stratford. This is a
summary slide showing the four sites, including number four at Tully. Total for the nadatorium is
the 52.5. We have added a $2 million street modification allowance. It is likely when we add that
building and its occupants and visitors.

[01:56:30–01:57:00]
to that site, we will have to do a new traffic study. There will be additional vehicles coming. Um
they will have to study the time, the volume, um, and and when people are arriving and leaving,
departing for all of the sites. And there is a potential that we will have to do roadway
improvements around that facility. Um, we would only spend those dollars, obviously, if it was a
requirement by the authority having jurisdiction, but we want to plan in for it now so that if it if
it goes on that site, we have the funds appropriated. Thanks. So I guess I did hear uh

[01:57:00–01:57:30]
you know talking through this, there are folks that have kind of this this memory around here. And
they recall that when Tully was put together, the Don Coleman complex was put together, uh, there
was some agreement with Houston for emergency staging. Does does this impact that at all, or do we
have to look into that? Has someone looked into that? As of recently, we have not looked at this.
Harris County will come to

[01:57:30–01:58:00]
Spring Branch every now and then with a very blanket uh request to be able to utilize our parking
areas for emergency use. Jennifer, we this will come up every two years, every four years, something
along those lines. Uh even Red Cross will come up, um, John, and ask us to kind of go into an
agreement. Um, of course, keep in mind the city or Harris County or the government, whether we have
that agreement with them or not, they they would we would agree eventually. But uh",0
59,1:58:00,2:00:00,"[01:58:00–01:58:30]
But um no, uh we've not revisited that as of yet. As of late, and and Jennifer, you can correct me
if I'm wrong, but part of those agreements have never has been the use of our facilities, and it was
never the use of our facilities because you guys have 1,200 parking spaces or you've got this type
of square footage. If you if you recall, um after Hurricane Harvey, we had Don Coleman utilized by
um the outside agencies for our parking area, as well as Don Coleman for showers and other things.

[01:58:30–01:59:00]
Hours and other things paged assisted us with that. That that's accurate. And um the chief's not
here tonight, but that also that MOU will run through the police department as well. So but it's
it's been several years since we've been asked to revisit that. That's a good point though. Yes,
that's true. I I actually um to be honest with you, um they they wanted us to pour uh the pain
sorry, I'm sorry, uh when when we were pouring

[01:59:30–02:00:00]
uh the concrete at uh when we were redoing the concrete at uh Tully they actually wanted to us to
pour it to a deeper depth so that we could um because so that we could handle all the tankers and
then supposedly there might have been monies that might have been provided but then and we would
have even been a fueling uh station but then uh then that didn't come through and so uh that was
during uh Chief Bronner's era and so we didn't we didn't end up doing that so there's certain things
then we",0
60,2:00:00,2:02:00,"[02:00:00–02:00:30]
couldn't uh host there. And there are certain things that, you know, again, we primarily uh took
care of law enforcement and the Don Coleman and also used Stratford for um to to feed folks there.
Yeah. Yeah. Thanks, Patrick. Yeah. Uh one point of clarification. So the $54.5 million and that $2
million street modification allowance, that that applies at any of the four sites. So the district
will ultimately select a site and there could be that need at any of the four once you do the
traffic study and you and you understand its impact.

[02:00:30–02:01:00]
Don Coleman, uh no noted changes to limitations and considerations, the aerial for context, no uh
major changes in the scope inclusions, and no major changes to the conceptual plan. We have provided
a two hundred and fifty thousand dollar allowance um for an alternate alternate facility rental, um,
being that if Don Coleman is disrupted for a duration during construction and you need to relocate
different events.

[02:01:00–02:01:30]
you may need to encumber and counter some rental facility costs, transportation costs. So that again
is another allowance that would be provided and only spent as it was necessary. We have also added,
so expanding that parking if Stratford Softball in the option B were to relocate softball, adding
that parking lot in the lower right corner and the detention underground would be about 3.6 million.
So the 25.8 includes both of those considerations.

[02:01:30–02:02:00]
Tolle Stadium, no noted changes to limitations and considerations. The aerial we are all familiar
with. We have added a graphic and some analysis to highlight regional Texas football and athletic
stadiums in the area. We feel like uh we wanted to highlight a couple, right? Darrow Tolle is
highlighted at the 14,500 capacity we discussed before, which is very high. We have color coded the
other capacities of the regional stadiums by that capacity. So you see the",0
61,2:02:00,2:04:00,"[02:02:00–02:02:30]
14.5 was really high only below San Antonio ISD, and then it quickly goes to 12, but more
predominantly 11 and 10,000 seats. So that shows you that that seating capacity has been utilized in
recent renovations and new stadiums in many of the district districts surrounding this area and
throughout the state. So we thought that was added context. You guys asked us what what type of
capacity Spring Branch needs, and we should be looking at, and where did the 14.5 come and land
relative to our neighbors.

[02:02:30–02:03:00]
No major changes to option B. And the only clarification is you see highlighted on the right side,
this is uh concept B, which is the Tolle Stadium major uh renovation, the modernization of the
stadium, with eleven thousand seats, with the single rake concrete bleachers maintaining, if you
will, the same essence, the same style of Tully as it exists right now. So not the split. This is
just as it looks today, right? Correct kind of guy.

[02:03:00–02:03:30]
Correct. This is new concrete where the existing concrete is in the same style sloping down towards
the bowl. This graphic that we added is intended to clarify that for all the viewers and anyone,
right? There's a lot of complexities we're talking about, but you can see a new press box, um, new
elevator, new support buildings on top of a berm with the single rake. You see on the right, eleven
thousand seats would go that far, approximately up the berm and provide an upper bleacher area, a
small concourse, and then a lower bleed bleacher area with

[02:03:30–02:04:00]
the field level down below. So you're looking down. So all sight lines, but again a single rake
concrete structure for all of the grandstands. We wanted to provide a visual. This is Rhodes
Memorial Stadium, which is in Cady. This is an example showing you similar style. There is a berm on
both sides, there is a press box and support building on the left on the home side, then there is
the single rake upper and lower with a small concourse in between, and the field down in the bowl.
This is similar to Tully.",0
62,2:04:00,2:06:00,"[02:04:30–02:05:00]
We studied the seating as requested. So this graphic, these thumbnails, show that 9,000 capacity,
10,000 capacity, and 11,000 capacity all work with this option B with the single rate concrete
stands. It just you know as you add seats, you go further up the berm, whether you're at 9, 10, or
11. So again, we've included 11 at this time. Um we can reduce that if if directed.

[02:05:00–02:05:30]
Concrete about $2.5 million for every 1,000 seats if you were to reduce from 11 down to 10 or 9.
Option C: no major changes to the scope. We wanted to highlight, we included again 11,000 seating
capacity, so we're comparing side by side. This is with an upper deck seating. So you can see the
purple existing, the existing berm comes down a little bit farther. You still have home lower
bleacher seats, which provide the bowl for.

[02:05:30–02:06:00]
Provide the bowl feel. The field level is still down depressed from the built-up berms, but the berm
is not quite as high. You use your buildings to create the concourse in between the home lower
bleacher seats and the home upper seating deck so that there's a space for people to go, whether
it's in inclement weather and rain and snow, or whether it's you know to get out of the sun, to go
to concessions, it just clears those up and is a second consideration. Again, nine, ten, or eleven,
but we've shown eleven.",0
63,2:06:00,2:08:00,"[02:06:00–02:06:30]
Can I ask a question real quick? Does the um does the elevator tower come down? What are we doing
with that since it never works? The elevator itself needs to be replaced. The elevator tower uh
needs to be able to accommodate a larger elevator that fits a gurney, so it needs to be replaced
regardless of our option. Um so in these diagrams we've shown it being relocated and pushed back to
provide easier access and not have the actual connecting bridges. Um so those purple lines you see
are existing and

[02:06:30–02:07:00]
the shaded area. Again, this is just a conceptual diagram. You guys will will hear ma more uh
options about design options and how that ends up resulting if it's a successful project and moving
forward, but it is to illustrate that the elevator gets replaced and relocated to better serve and
get you up connected from the press box to the concourse down to the parking lot level. The example
we're showing is Tomball Stadium. Tomball ISD has the upper deck, has the concourse in between the
two and then has the lower

[02:07:00–02:07:30]
Lower the lower seating with the field. You also can notice the one-story new press box elevated up
above for the for the premium sight lines and the ability to see that entire field. It also has you
notice the blue ribbon banners, which we've noted before, could be placed around the facility, but
in this case are shown on the front of that upper deck. So the two photos, hopefully, and the two
sections conceptually can help better communicate and understand the difference between B and C. For
option C with the upper deck, again, it will work at nine, ten, or

[02:07:30–02:08:00]
The delta between every thousand seats in this comp concept is about three million. Previously
stated about two and a half million in concept B because these are elevated seats. So you get a
little bit more of a savings, but it's a different feel in the stadium, so it's your option whether
you prefer to further pursue B or C. We are carrying at this time option C 11,000 seats at that 77
million. And we've updated our option comparison so you can see the difference between B and
difference between C in allowing you to.",0
64,2:08:00,2:10:00,"[02:08:30–02:09:00]
pursue some additional enhancements, consider the wraparound boards, centralize your ticking
ticketing, lower the berm to allow the buildings to get a little bit larger, and designate your two-
tier seating. Again, total cost 77.8. We have added in a similar allowance, as I mentioned before,
at Don Coleman, of $750,000, anticipating that during construction, Tully is taken offline and
athletic events need to.

[02:09:00–02:09:30]
need to be relocated. So we would work with athletics, facilities, transportation on options and
cost, but we wanted to identify at this point that we need to plan for an allowance so that when
those are come across they can be addressed. You can spend bond dollars on that c the cost of that.
Yes.

[02:09:30–02:10:00]
The summary we have updated here for scenario three included the total construction costs totaling
to the 434. That includes the roll-ins from scenario two, the updates in scenario three, and the
additional considerations. So we can come back with additional options. We can take any of those
additional considerations out or adapt them as necessary. We wanted to talk again that total project
cost is one part of the cost. When you add in the soft costs, you escalate it over time and you plan
for a",0
65,2:10:00,2:12:00,"[02:10:00–02:10:30]
total project. We then set a year in which you would sell the bonds, bid the project, start
construction, and we escalate it based on that time frame to expect uh you know costs to increase
over time, and so we've escalated them out from 2025 to 2029 with the help of our third party
estimator, and that would provide you with the update for scenario three at 647.5 million, inclusive
of all of those options as described tonight.

[02:10:30–02:11:00]
Potential bond propositions, as mentioned earlier, could be three, could be four. We have simply
grouped them. If there was a proposition for the high schools, that would be three forty-four.
Proposition for Grobe could be seventy-two point eight, seventy-six point nine for the natatorium,
and 153 for Don Coleman and Tully Stadium, combining those again to the total of the six forty-seven
point five.

[02:11:00–02:11:30]
And concluding with our next steps, it was mentioned a shortened time frame. We are preparing for a
February third workshop for continued discussion, a special board meeting on the tenth, and then
AASC meeting number three on the nineteenth. Any further questions? I have I have some questions. Um
let's assume that these

[02:11:30–02:12:00]
These let's just assume worst case scenario. No project passes. Okay. Or, you know, maybe the high
school improvements passes, but nothing else passes. And then we have Tully Stadium, which is
already 10 years past its expected lifespan. We're at 60 years, its lifespan was 50. Where where do
we get the money if if we have to make maintenance and improvements? I know you're laughing. And and
it it is kind of laughing. No, I know we're not really laughing.",0
66,2:12:00,2:14:00,"[02:12:00–02:12:30]
but it's kind of a joke, right? Because we don't have the money, I assume. But let's just say, you
know, a group of steps crumble, our bathrooms quit working because the plumbing is so outdated.
Let's say our technology, you know, doesn't work anymore because of the advancements in technology.
These different little one off things that are going to continue to happen, whether it be to Tully
or the Natatorium or any one of these things, where do we get the money as a district if no bond
money is passed?

[02:13:00–02:13:30]
to do these projects and to maintain or fix things. So I can answer from an operations standpoint,
and I know that Christine can additionally can provide some additional information. Our maintenance
budgets are designed to maintain, but to the extent or the severity of the failure that we could see
on some of these much older items or older facilities, we

[02:13:30–02:14:00]
We unfortunately do not have that type of maintenance and operation budget to account for those. You
know, when you take a look at Tully Stadium and the fact that the restrooms function like they do,
we struggle. But when I talk about the fact that we don't have dollars to maintain or to make those
major repairs, we are use utilizing a lot of dollars in man hours to maintain.",0
67,2:14:00,2:16:00,"[02:14:00–02:14:30]
these aging facilities. So our dollars are going somewhere. And just that's you know from a
maintenance and operation standpoint, I don't mean to to stumble, but the reality is that we have a
budget and that budget is limited and when we utilize dollars here, that means that dollars are not
able to be utilized elsewhere. We continue to have roofing needs, we continue to have chillers that
are needing to be replaced.

[02:14:30–02:15:00]
Replaced, all of our facilities are aging, some more, uh some faster than others. I'll I will pipe
in here only because I ran operations for six years prior to stepping into this position, and that's
absolutely true. In fact, in the with the 2007 bond, and I think I've explained this before, I'll
explain it again, but with the 2007 bond, we were fortunate to have some unallocated interests that
were we were able what we did was we took that unallocated interest, we put it to the side, and we
put it in categories because we didn't have main.

[02:15:00–02:15:30]
Because we didn't have maintenance money to replace chillers, like large items, roofs, chillers, and
other large systems. And so we've been super fortunate to have that money because otherwise we
wouldn't be able to replace like a $250,000 chiller. Like that's not in the budget. So the other
thing I will say is having worked in operations, you know, we talk about work orders all the time
and work orders backing up, and you've asked me about that before, but this is part of the problem.
And so between safety and security, those work orders have to always

[02:15:30–02:16:00]
be done right away. You know, it's the same people that are fixing those things that are then also
addressing these larger items. And so, for example, the plumbers, and I may not say this exactly
right, so I'm just gonna use plumbing as an example since we're talking about the toilets at um at
Tully. So the the plumbers will go out there and the situation is they're so old, you're just you're
just putting a band-aid on it, but it's gonna break again. So you have plumbers that can't even get
away from a project, they're constantly going out.",0
