chunk_id,window_start,window_end,text,binary_hit
57,1:54:00,1:56:00,"[01:54:00–01:54:30]
have that dialogue. I about the breakfast is I want to give a shout out to Naja, Deputy of Um
Community Outreach External Affairs Face. I think I saw her. Thank you so much for coordinating. We
told Naja like the week before, hey, we want to go to schools before break. And she really helped
us. So thank you to her and her team for that as well. And thank you for y'all because I know some
of you were probably there like six o'clock. Yeah, so thank you. All right, thank you all. Thank
you. Oh, sorry. Yes, ma'am. Yes. Can you share again how the community can make a request?

[01:54:30–01:55:00]
for meetings and also second question have we been able to meet all the requests for engagement?
Okay. That's a great question. Um board services, emailing board services is the best way to do
that. They have access to all of our calendars and and we'll work to get um board members at
different meetings and and work with the schedule. What was your second question? Have we met all of
the requests? Oh thank you thank you. Actually no and it's because I think we request started coming
in either the end of November or maybe early December and we had already had

[01:55:30–01:56:00]
our calendars kind of booked, and so um we are starting that engagement. Some that were left over
from last last year were already have some scheduled and we're working on the others, so we are
actively trying to meet the request and and work on those calendars. Okay. Yes, thank you all. Thank
you, thank you so much. Very good. Um okay, Superintendent Miles, you're going to present board
monitoring update on goal three progress measure three point three yes, ma'am. I'm gonna ask Chief.",0
58,1:56:00,1:58:00,"[01:56:00–01:56:30]
As uh Chief Kristen Hall and her team to come up. Let me know if you're ready. Um okay, I think I'm
ready.

[01:56:30–01:57:00]
Oh yeah, I can hear that. Thank you. All right. Okay. Good evening, members of the board. Today
we're reporting out on Goal Progress Measure 3.3. Goal three overall is the percent of students
graduating TSI ready with industry based certifications, and we've shown to be on track for that
last year. But 3.3 more specifically is the focus on the percent of 11th graders who qualify for
college credit. And the goal is that.

[01:57:00–01:57:30]
they will increase from 33% in May to 48% in May 2028. So wanted to start with just looking at the
high level results of this goal progress measure. On the left side, you see reports out at BOI, MOI,
and EOI for the past three years. I first want to call your attention to the BOI score each year,
and you can see that it was 19%, 23%, and 26%. So at the BOI, you see it increasing over time, which
is a good indicator that we're improving in this metric. Also within one year,

[01:57:30–01:58:00]
what you see is that at the beginning of the year we start lower, significantly lower than at the
end of the year. And that's because at the beginning of the year, it's really measuring students who
obtain college credit in ninth and tenth grade. But by the end of the year, we're actually able to
also count students who got college credit in their 11th grade year, which is why you'll always see
it go up from BOI to EOI. And so if you're looking at end of year last year, you see we already
actually exceeded this year's target. We were at 38 last year, and the target for this year is 35.
So we're anticipating that we're going to.",1
59,1:58:00,2:00:00,"[01:58:00–01:58:30]
That we're gonna exceed it again, and that we're on track for this metric, both because we're seeing
beginning of year growth and because last year end of year results were really strong. When you look
at this data split out by student group, we generally are seeing that overall increase from BOI to
BOI. We're seeing some significant increase in Asian and white students. Um, but we did see a
decrease for black students, for uh EcoDis students, and for students with disabilities. We dug into
this a little bit more, and one of the things that we are observing.

[01:58:30–01:59:00]
is that when we're looking at enrollment in current college coursework, we're actually seeing
enrollment increases for these subpopulations. So for black students, for example, we saw a 6%
increase in enrollment currently in their college coursework, which just tells us this number will
likely improve by the end of the year because they're currently seeing increases in enrollment, even
though the BOI to BOI saw a decrease. So it was just a way to say that some of the things we're
doing to improve this data for subgroups, we anticipate to be working by the end of the

[01:59:30–02:00:00]
year. We also just wanted to look more specifically about the different ways students can obtain
college credit. So there's four ways in HISD where you can get college credit. First is our advanced
placement courses, REP courses. Second is IB. Third is dual enrollment, which is with UT through our
on-ramps program. And fourth is dual credit, which is college credit through HCC as well.",1
60,2:00:00,2:02:00,"[02:00:00–02:00:30]
So what we've shown is in 2022, 23, and 24 at the beginning of year, for each of those subgroups,
what the results were. And you can see for all four of, well, for AP for dual enrollment and dual
credit, we're increasing beginning of year college credit in all of them. And that's actually a
really good sign because it what it means is we're not cannibalizing college credit in one area by
just increasing it in the other area. They're actually going up in all four types of college credit.
For IB, you see it zero, but that's because students take the IB test in 11th grade, so at the
beginning of the year.

[02:00:30–02:01:00]
it will typically always be zero. So that's what this helps us track as well. The other thing you'll
notice is that students will get college credit in multiple types of these, so they might get
advanced placement credit and dual credit at the same time. And overall, um, this report is showing
that we're on track. And I do just want to name some some really big successes in this area. Um,
College Board did actually call up HISD recently, and they said that we saw uh just for advanced
placement courses.

[02:01:00–02:01:30]
alone. We saw a 15% increase in unique students taking advanced placement courses, a 24% increase in
the number of advanced placements tests that were being taken, and a 5% increase in the pass rate of
advanced placed courses. And they anticipated that this was a $15.6 million tuition saving for
students, this improvement, which is just such a huge win. They also shared that it was from their
data the highest numbers they've seen in HISD's history. So it's just really great progress in that
work. And I do think some of the

[02:01:30–02:02:00]
things the policies and procedures we're putting in place to increase these numbers are
demonstrating to be working. The next big thing is to just pause and talk about some of the things
we're doing. We have talked about opt-out scheduling and advanced course scheduling before, but that
work continues. So we still have the opt-out scheduling policy and we're improving it. So when
students are scheduling their courses, if their academic data shows that they are prepared for
college credit courses, that is what they will see in their course selection.",1
61,2:02:00,2:04:00,"[02:02:00–02:02:30]
tool, and they will only be able to take on level courses with parent and counselor approval. So
that way they can continue to enroll in the courses that they are ready for. Once they sign up for
their course schedules and they actually get placed in a schedule, we also have a tool to make sure
that that happens appropriately. So there's multiple checks and balances in the system. We looked at
a couple of example data. Whenever we were looking at math, we looked at the percent of students who
are ready to take advanced courses when we started this work. And in math, we saw it was.

[02:02:30–02:03:00]
13% of students who are ready that were actually getting enrolled. And in reading and language arts,
30% of students who are actually ready were now getting enrolled. In this most recent scheduling, we
are at 73% of students who were showing that they were ready were actually getting enrolled. And so
we really are being very intentional about using data to make decisions about which courses students
can be most successful in. In addition to that, and so that's really just one policy that focuses on
access. The other policy that I still

[02:03:00–02:03:30]
Another policy that I still want to name is once students are demonstrating readiness, we're
improving their scheduling. But we also have to get more students to that readiness bar, and so
that's that continued focus on improving math and reading throughout even in ninth grade and tenth
grade, that double block in math and reading for our high school students, so more of them are more
likely to be ready for that advanced coursework as well. And then always we are continuing to focus
on high quality curriculum for these courses as well as high quality instruction for these courses
because that's once once we

[02:03:30–02:04:00]
improve access, um improving actual attainment of credit does ensure that um all of those teachers
are teaching those students at the right l uh rigor of the standards for that college coursework. Uh
and that's it for today. Great work, thank you so much. Okay, questions. First of all, I will say
this board has submitted 22 questions on the monitoring report. So let's not go over tactical stuff
that we've already asked about, but so strategic. If we can try. Yes, ma'am. Uh Dr.",1
62,2:04:00,2:06:00,"[02:04:30–02:05:00]
Dr. Arnold. Thank you. Before my question, I want to commend the administration on the use of AP
potential as a data driven tool to get students into courses that they have proven that they are
ready for. I know that there are a lot of other states and districts that do not use the tool. And
when they ask for data driven solutions, the College Board mentions this particular tool. So kudos
to the district for doing that. My question, a strategic question, is about the goal. So if the goal
is to grow the demand for these courses, have we had

[02:05:00–02:05:30]
a problem or do we see a problem having the right teaching force available to teach all of these
courses? Yes, and that that differs by the type of college credit course. So for example, in dual
credit, we can get a we uh the the teachers, the instructors that teach the course, they can either
be HCC instructors that they're sending to us or they're our instructors, and that really can just
depend on availability, but that can be a really hard thing to figure out sometimes if we can't get
that instructor.

[02:05:30–02:06:00]
Instructor. It really does often depend on even prerequisites to be that instructor, which also can
be a barrier. Sometimes we've been able to be, we've had a lot of success. If we can't, if there if
HCC dual credit path doesn't work, we also can look at UT on ramps. They have slightly different
requirements for how you can be instructors, and that's actually been a really help and give us some
flexibility.",0
63,2:06:00,2:08:00,"[02:06:00–02:06:30]
of flexibility in how we could find instructors for those courses. And then for AP courses, we need
to make sure they are properly trained and they attend the the AP trainings as well. Thank you. Mr.
Ravon? I um I also wanted to commend the uh operations of the district in this regard. The results
that that we're seeing in bringing more students into the fold is is so impactful. I mean obviously
you've you've read the kudos from

[02:06:30–02:07:00]
um the college board. But um I think it's it's critical that we continue to focus on um not only
students that are challenged, but students who are not receiving the service they should and and be
pushed um to exceed and excel in the things that they do. And I um I'm very pleased to see the
results and I I'm excited about what's to come. And I do think about capacity um as well, um, and
ensuring that that not only we can uh provide for those students, but in all areas.

[02:07:00–02:07:30]
of the city where it's needed so that all of our students get an opportunity to be in that place.
Any other Yes, ma'am, Ms. Ozeanne Bandy. Thank you so much for the information. That's great to hear
those stats that you called out. I'm wondering if I'm a student and you know all my scores identify
me as someone who could benefit or who qualifies for AP or dual credit courses.

[02:07:30–02:08:00]
and my school doesn't offer them. What what options do I have if I want to do AP chemistry and
there's no AP chemistry class at my school? That's a great question. One of the things we actually
do, we do two things to that. One is in all of our core contents, we are standardizing the course
sequence to say what courses follow other courses to ensure we can provide access to those advanced
placement courses in our core content areas so that we can at least say those are a commitment.",0
64,2:08:00,2:10:00,"[02:08:30–02:09:00]
Commitment. Sometimes there's AP courses even outside of those that may differ across campuses, but
for our core content areas, we want to be very clear on what we can provide in that path for
students. The other piece to that is actually about the scheduling. So once we identify who is, you
know, who's what students are ready, students go and collect their schedules, and that actually will
tell us the number of teachers we need and the number of courses that we need at a particular high
school so that when we go to do our scheduling, we actually can make sure we have the right number
of teachers to teach those courses. And so that actually is a big part of how we make.

[02:09:00–02:09:30]
sure we're planning appropriately on the schedule side as well. And Ms. Slender? Thank you. A few
questions, but first, uh, if you could, I I can't see the slide anymore, but it looked like dual
credit, the the percentages of dual credit is about half of what AP is. And so I'm wondering why we
don't see more dual credit. Like you said, there's a huge savings potentially for students in
college. So I'm I'm wondering if you could speak to that.

[02:09:30–02:10:00]
The first thing I'll clarify there's savings across all of these as well. So the savings, the five
fifteen point six million number, that was actually for AP. And a lot of it just depends. So for our
dual credit courses, for example, we have to find a course at that institution that matches one of
the TEA required courses and crosswalk that.",0
65,2:10:00,2:12:00,"[02:10:00–02:10:30]
To see at the same time as they're enrolled in our high school, so those courses have to match. One
of the things that we actually are in the process of doing, even for dual credit, is integrating our
foundational programs of study for CTE with our HCC partner. So we're going through every course to
say, do you have dual credit courses in our CTE programs of study that can overlap so we can provide
dual credit and CTE at the same time? But for us, it's been a process of sitting down and finding
those points of overlap because when we do, then we can increase the course offerings for our
students in dual credit.

[02:10:30–02:11:00]
Thanks. I wanted to get to that, which is yeah, what are some of the barriers or things that we need
to address to try to make this more available to more more students and bring coursework that that
ties to realistic work outcomes that we want them to be prepared for. Right. And one of the hard
parts is we can't just give them any HCC course that HCC has. It has to align. And so we're
increasing by doing that alignment work with them. The related to that, I'm wondering about college
readiness. I hear and

[02:11:00–02:11:30]
I hear anecdotally so many examples of even those students, you know, got into college, they show up
and realize they are just terribly unprepared for this. And so I wondered about while they might be
earning dual credit, how does that equate to actually college readiness? And what are some of the
gaps or barriers there that you're thinking about? I would say two things. One reason why this is so
important is because the research does show that even if you take a college credit course in high
school, and even if you don't pass, you

[02:11:30–02:12:00]
actually increase your predictability of college graduation. So even being involved in the rigor of
a college course before you get there, research shows could help. So that's, I would say, one thing
that's really important. And then the other thing is real that's really important is as we um as we
focus on this more, students will get more and more credit, which gets them even further along in
their college entry point, which can save them more money. It can kind of build them towards a path
or even swords towards some sort of stacker stackable credential certificate. And so that also can.",1
66,2:12:00,2:14:00,"[02:12:00–02:12:30]
just really help relieve some of the burden on college whenever they're transferring. Um and then
the last piece I would say that truly is important is some of the rigor of these courses and the
focus on this can still help make sure those students are meeting that TSI readiness threshold so
they don't have to take that remedial coursework. One more. Um as we go back to the slide where we
see the the breakout by student by student population, I think you know, some of those disparities
are are are unfortunately not shocking. Um

[02:13:00–02:13:30]
Um, but they are you know disappointing. And I wonder about what your thoughts are about what do we
need, right? What do we need to accelerate our students who are not um you know at the same level as
as some of our other student populations um uh to to really accelerate their their their growth in
this area as as soon as you know as soon as we can. Um I think two things for this. First is with
the focus on a student's readiness data to be the decision that places them in the classroom.

[02:13:30–02:14:00]
that actually helps raise that expectation for all student groups. Our data has shown that a lot of
these student groups have been placed in advanced courses at such low rates even when they're ready.
And so using data to make that decision through processes that have checks and balances, I think
raises that expectation that all the kids across the student groups with readiness data can rise to
that level. So I would say that's the first thing. The second thing is really that really important
focus on if students are not yet ready, how are we making them ready? And that",1
67,2:14:00,2:16:00,"[02:14:00–02:14:30]
is the the purpose of that focus on high quality instruction in all grades, kind of first, second,
all the way up. And even when we get to high school, that that double block in ninth and tenth and
reading and math again to make sure that as many students are ready for that as well. Because if the
other thing I didn't talk explicitly about, but we have ways to say if a student is not ready when
they come in ninth or even tenth, but they become ready, we have ways to catch them up so they can
still get to that advanced coursework before they graduate. We have things that we can do in the
schedule to catch them up.

[02:14:30–02:15:00]
And so again, I think it's that focus to raise the achievement and growth for all of those students
who are not yet at that threshold. Any other questions? All right. Thank you, Chief Hole. Thank you.
That was a great presentation. Thank you. Okay. Do I have a motion to accept the board monitoring
update presentation of goal three, progress measure 3.3? Ooh. Uh-oh, our screens are my computer.
Hit my computer. Maybe a couple times.

[02:15:00–02:15:30]
Oh, mine's not working. Ah, there we are. Okay. Motion to accept by um uh Miss Linder and a second
by Miss Bandy. Please vote. Nine in favor, zero opposed. All right.

[02:15:30–02:16:00]
Now we are going to discuss the items that are pulled from the consent agenda. May I have a motion
to approve agenda item six approval of proposed revisions to board policy AE local educational
philosophy second reading. I have a motion by Mr. Campo and a second by Mr. Martinez. Now this item
um relates to constraint three. There was a the committee met after last um last month's meeting to
consider the discussion that we had at the last meeting.",0
68,2:16:00,2:18:00,"[02:16:00–02:16:30]
Um the committee sent out a PowerPoint presentation to everybody. Hopefully, you had an opportunity
to look at it. We can pull it up if we need to talk through the changes that were made and the
reasons for them and uh the considerations that were made. We had a pretty robust, I guess we met
once or twice. We met twice to talk about everything that was raised during the meeting last time.
Um and so you have our final draft. The administration took a look at it again. Everyone's
comfortable with the the current status of what's in front of you. Um but the committee is ready to
answer any questions.

[02:17:00–02:17:30]
I'm sure the administration is as well. So um, and we can pull up the PowerPoint if we want to and
walk through the changes if that's something that somebody wants to do. But any questions, comments?
You want to pull up the PowerPoint? Okay. I made a promise and now I have to fulfill it. Okay. I
need help. I have no, you don't, you have the PowerPoint. It's the one that's been posted. Can we
put it on the screen? Okay. We don't have that stuff here. Sorry.

[02:17:30–02:18:00]
Oh great. Thank you. Oh, okay. What item was? Oh, just one.",0
69,2:18:00,2:20:00,"[02:18:00–02:18:30]
Okay. I have my I have it up on my iPad if that's helpful. Yeah. No, on your on my iPad. Oh, okay.
Sure.

[02:18:30–02:19:00]
Sure. Are there any questions in the meantime before we pull it up? No? Okay. Yes. Yes, ma'am. Sure.
Thank you. Um can can we speak to um one of the the bullets under the recommendation that reads the
results of stakeholder engagement related to the end.

[02:19:00–02:19:30]
To the anticipated changes to programming or school options. Can we define stakeholder engagement
and just kind of talk through what that looks like? Yes. Let me find that. Oh, I'm sorry. Okay, so
you're talking about um the language that reads that what you just said. So you're talking about
what is a stakeholder engagement. Yes. Um uh Chief Hole actually did a nice job of talking about
that last time. Um

[02:19:30–02:20:00]
You talked about the work that was done. I I think we're comparing or explaining through examples
the work that was done with respect to the changes to pro the programmatic changes that were done to
the schools that we approved or heard about over the last several months and what was done in those
engagements. It sounds like to me that the engagement depends on what the change is, but maybe you
can speak to what's anticipated in terms of some standardization or otherwise. Yes, of course. I
think one of the things we mainly wanted to make sure we were supporting principals and communities.",0
70,2:20:00,2:22:00,"[02:20:00–02:20:30]
in doing was it um ensuring they were getting staff uh engaging the staff in the decision, engaging
the community uh in the decision uh as well, and then engaging the students when that made the most
sense. So um, and then they could use those three points of input um uh across all of those
different stakeholder groups when they were proposing the change and considering the change, um, and
that's included in each of the impact reports that are part of meeting the constraint and where are
these impact reports located? Are they expensive?

[02:20:30–02:21:00]
Located, are they accessible to us, the public? How how do we because again I I think it's great
that we are actually um placing those somewhere because for historical purposes moving forward we
can look back and see why we made changes and and things like that. So how accessible are they? Um
the board does have them and we can look into a process for that. Thank you. Any other questions
without the aid of demonstratives? No. Okay. We got it? No?

[02:21:30–02:22:00]
No? Oh uh oh. Okay. What? I have one question. Yes. Um there was a there was a timing piece I think
that you bring up that tied to like EHBJ, um where we we had like maybe a fiscal year and we changed
it to a year or or vice versa. That's right. So uh you want to talk about that issue? Just in
general. Um so Chief Hole talked about that. Um I think",0
