chunk_id,window_start,window_end,text,binary_hit
25,0:50:00,0:52:00,"[50:00–50:30]
And then there's always the risk of revenue, improper revenue recognition. Although there's not a
profit motive in a governmental entity per se, we do want to ensure that the revenues recognized in
the financial statements for this fiscal period are correct. So that applies for state aid, property
taxes, and your grant revenues. No difficulties in report in performing and completing the audit. We
had the district's full cooperation. We do ask for a tremendous amount of information. We asked to
meet with individuals. We ask questions throughout the audit process, and so anyone we asked to meet
with was made up.

[51:00–51:30]
Asked to meet with was made available. Questions we asked were answered in a timely manner. So we do
thank the district management and staff for their cooperation and patience through the audit
process. I always say that you can't just get ready for the audit. The district has to be doing
their duties, their responsibilities day in and day out. Otherwise, you'll you're behind. So kudos
to the district for staying on top of everything, uh, your reconciliations, your processes, in order
for the audit to go smoothly and for this report to be presented to you and will be submitted to all
the stakeholders before they're.

[51:30–52:00]
Before their deadlines. No disagreements with management when it came to the application of any
accounting principles or accounting estimates. We do obtain a letter from management referred to as
a management representation letter at the end of the audit. That letter makes sure that nothing's
been withheld or from being provided to us, being reported in the financial statements or disclosed
in the financial statements that would change the opinion of the users of the financial statements.
As far as we're aware, the district's not consulting with any other auditors or accountants on any
financial reporting or compliance related matters. In the last bullet during the year, we may answer
questions and provide.",0
26,0:52:00,0:54:00,"[52:00–52:30]
guidance, but at no time do we feel that that impairs our independence from being the district's
external auditors. So at that point, I'd be happy to take any questions about the audit or the
financial statements or the federal single audit. Thank you.

[52:30–53:00]
I I will ask one question. Um will you I guess break it down to non accountants? What are fund what
is a fund balance? Is it a savings account? Is it a rainy day fund? So fund balance is not a savings
account, it's not a rainy day fund. I would describe it as your working capital. That's what you
need to operate. Pay your employees, pay your vendors until revenues come in later in the fiscal
year and the subsequent fiscal year to fund operations. So it's nothing that's been set aside that
you can use.

[53:00–53:30]
for any particular reason other than just keep the district operating. And that's something that
credit rating agencies look at closely every year that when they look at the district's financial
health, they look at to see what is the level of fund balance because that drives your credit
rating, which drives how much it costs for you to borrow money for your capital projects. So it's
important to have a a healthy amount of fund balance, an adequate level of fund balance in the
general fund would would you advocate using a fund our fund balance to

[53:30–54:00]
run a deficit and continue to run a deficit year after year? What school districts have to be
careful of when they decide to use fund balance is are you using it on a one-time expenditure, or is
it something that's going to be reoccurring? Because it may not be just a one-time deficit. It's
going to be a recurring deficit year after year, especially if it's for salaries and benefits, if
it's for employees, which is your number one expenditure line item in your budget. So is that a no
that you wouldn't recommend that we use a fund balance for recurring expenditure?",0
27,0:54:00,0:56:00,"[54:00–54:30]
Expenditures. I would not recommend that, especially in this environment we're in where there's a
lot of questions and uncertainty related to state funding. Thank you. You're welcome. Anyone else?
All right, appreciate it. Thank you. The next item on the agenda is an annual report of bond
oversight committee. Dr. Blaine. Yes, I would ask uh Travis Stanford to come forward, and we also
have our two fabulous bond oversight committee chairpersons with us this evening who.

[54:30–55:00]
uh committed to several years back a 10-year commitment to oversee not only the 2017 bond program,
but the 2022 bond program. And so with us we have Kathy Goss and we have Lewis Gissel. And Travis, I
apologize if I took your your opening, but I'll turn this over to you. Thank you, Board President,
Superintendent Dr. Blaine, and trustees. Yes, we have Kathy Goss and Lewis Gissle here this evening
to give the annual bond oversight committee report to our trustees.

[55:30–56:00]
As Kathy and Lewis, as Kathy and Lewis get ready to present. It was only last week that we had our
last quarterly Bond Oversight Committee meeting, and we were actually able to host it at the
renovated and the added on Valley Oaks Elementary cafeteria. And we had a couple of surprises for
them. We showed them the fine and performing arts truck and trailer, as well as the additional
classrooms added to Valley Oaks. So with that, I will turn it over to Kathy.",0
28,0:56:00,0:58:00,"[56:00–56:30]
Goff and Lewis Giffel. Thank you, Travis. I do want to say that the surprise was great. Those
trailers and those trucks are fantastic. And I can't imagine how we lived without them. That was
really great. We had them. I always keep saying the I we keep asking Travis in Houston to show up in
the band outfits just to kind of show us how how breathable and user-friendly, but that has not been
one of our surprises yet. So uh Dr. Blaine, President Alpe, members of the Board of Trustees, nice
to see you guys again. Um

[56:30–57:00]
Um I told Kathy before we came up, I said, gosh, I feel like I just did this. And she reminded me
that due to scheduling conflicts, uh, we actually presented uh in February of this year. So it so it
does feel like we we just did this. So uh Kathy, if you'll go to the next slide. So uh, you know
here here's here's our charge. You know, we were asked to take on originally the 2017 and then the
2022 blonds. Uh uh every once in a while I just gotta pause and say, okay, this committee is being
asked to oversee one point.

[57:00–57:30]
Oversee $1.28 billion of projects within the district, which is really an astounding number. And uh,
you know, we always talk about 2017 and 2022, but when you look at it as a whole, uh, I think it's I
think it's really impressive. So we're gonna quickly kind of go through the five charges and uh then
we'll open it up for for any questions. Uh next slide, please. I think it's important to remind you
of who the members are on this committee. Uh we've got a great representation uh across the
district, lots of different interests, lots of different disciplines representing a wide swath.

[57:30–58:00]
of uh residents in SBISD with different interests. Uh we expanded this committee to 23 members uh
with the addition of the 2022 bonds. We did that in we did that last year, and that that number
currently stands at at 21 members. Uh attendance uh is amazingly strong. Uh when people aren't able
to make meetings, there are emails as to exactly why they can't make it. And when we looked at this
year's schedule, one of the things that we did from a planning standpoint is to make sure we're not
too close to.",0
29,0:58:00,1:00:00,"[58:00–58:30]
graduation. We had a lot of people that missed our May presentation because it was too close to
graduation. So okay, so our first charge was ensuring the bonds remain faithful to the priorities
identified in the 2017 bond. What I will tell you is that this has now been seven years that this
has been in motion. This was largely a facilities bond, as as we all know, and it was a 10-year
plan, and the priorities remain largely the same, and I'll explain that in just a minute. I look at
the expenditure.

[58:30–59:00]
Look at the expenditures, and when you look at uh and this is through September, September 30th, uh
total uh expenditures are six hundred and nine million dollars, which is sixty-seven percent of the
of the total allocation. Um when I say the priorities remain remain largely the same, as we all
know, uh as a as a as a board, uh as an administration, as members of this school district, we had
to make some tough decisions as it relates to budgets. Um and we we all know that uh the Spring
Shadows campus uh did did not move forward. So the

[59:30–01:00:00]
So those forty forty-one million dollars in funds got reallocated to the contingency uh line item in
the budget. I know roughly 22 million of that was was reallocated to both Sherwood and to Terrence
Elementary School because those are the campuses uh that are gonna be taking on additional students.
Uh so we're aware exactly of where those that 22 million and uh you know I I know that that
contingency will be looked at uh you know once we get closer to the end.",1
30,1:00:00,1:02:00,"[01:00:00–01:00:30]
And the 2007 bonds, we had enough funds left in the contingency that we were able to do Rumble Creek
Elementary. And so, you know, we'll see what ends up happening ultimately, ultimately with those
dollars. Next slide is just a quick summary of the 2022 bond program. Again, this has been in motion
now for two years. You're really starting to see some of the projects and some of the allocation.
Travis mentioned that our last meeting uh we met at Valley Oaks, so we got to see the expansion of
Valley Oaks in the

[01:00:30–01:01:00]
But you can't go by Guthrie, you can't go by the Ag Center without seeing all the excitement that's
going on with those two particular projects. So if you look at the expenditures through through June
of 2024, that's $47.4 million, which is 12% of the original issuance. So second charge was a
quarterly review and evaluation of the information of the bond funds and the timelines. If you'll
see the box in blue, that's the typical agenda that we have on these meetings. What I will tell you
as we've now met.

[01:01:00–01:01:30]
28 times as a oversight committee. Uh we also had an additional meeting to kind of onboard uh the
new members uh that came on to the BOC. Uh and we as a collective group have attended over 70 PAT
meetings uh across different campuses. So uh I can't say enough about the group of volunteers that
have been on this committee uh and the work that they continue they continue to do. Um these
meetings are very smooth. I mean, we've been doing it, we've got a rhythm to how the meetings go,
it's style on how the reporting goes. Uh it's always great to hear from Dr.

[01:01:30–01:02:00]
Blaine about exciting stuff that's going on within the district, and then we go through all the
different uh departments, get updates from communication, transportation, finance, uh, CTE, uh,
performing arts, and then we get into the individual campuses and the work that's being done. So,
again, those those meetings have have got a good rhythm. Everybody on the committee kind of knows
how they work, and uh the presenters know when to pause because they know when the questions are
coming. Uh, it's kind of fun too that we do meet at the different campuses. We met at uh two
campuses.",1
31,1:02:00,1:04:00,"[01:02:00–01:02:30]
this year. As again, I shared earlier. We were at Valley Oak, so it's really kind of fun to see uh
what's going on, and uh we we hope to meet at uh MDE uh in 2025. Next slide. I just find to look at
these pictures, right? I mean, y'all have seen these, y'all have been to most of these events. I
really love the the picture on the upper upper uh left, which was the Ag Science Center. Uh that one
was was a lot of fun. What I love about that picture is that you you see some former trustees and
Carter Breed and uh

[01:02:30–01:03:00]
Karen Peck in there. If you attended that one, it was really cool to hear from John Perez, who's had
a daughter that has gone through the program over there, and Ed Valichak, who has been incredibly
involved as well to kind of hear their story and impact. So, you know, it's just it's just fun to
go, those the excitement. You know, you saw a lot of blue jackets as as well, so you could tell the
students were really, really excited. So these are the pictures. Uh I always think it's important to
share the pictures. So the third charge for us is a quarterly review and evaluation of the budget
status report.

[01:03:00–01:03:30]
budget status reports. You know, like I said, we kind of kind of go through these. What I'll say is
there's no significant change in the timeline. You know, although there was a a uh a period of pause
and evaluation, it's not like there weren't other projects that were able to move forward. So you
know the all of the timelines are still within the reasonable timelines that were that were outlined
for for the 10 year really the 10 and 5 year program. You know I'm preaching to the choir here. I
know uh a lot of you deal with this on a personal side outside a lot

[01:03:30–01:04:00]
of people in this room. Uh it is a little bit more challenging to get permits uh in the city of
Houston. It it really makes you appreciate uh the partnership that the district has with the village
when we do projects in any of the memorial villages. So um that's not to say that we don't love the
city of Houston. Uh I certainly don't want to go on record as saying that, but it is definitely a
little bit more challenging. Uh I see it professionally in my career in banking projects that get
get delayed for from a permitting process. And you know, hopefully, hopefully that will get get
better.",0
32,1:04:00,1:06:00,"[01:04:30–01:05:00]
better over time. Uh the next slide, Kathy. The the fourth charge is working with the staff and
assembling key campus stakeholders. This is uh a fancy way of saying the PATs and making sure that
there's engagement at the campus level. Um and again I shared earlier that that our committee has
participated in it ever over 70 of these these meetings. You can see the list on the right of uh
which committee member has been assigned to which campus. Um you know our our job really there is to
go sit and listen, make sure that uh

[01:05:00–01:05:30]
the communication is taking place, that questions are answered, and really just to observe. Um,
we're not there to facilitate, we're not there to participate and try to steer the direction in any
way, shape, or form. It's just to make sure that the uh the district uh staff and the architect team
are are getting feedback and taking that feedback and working into their presentations. And uh when
we get together, we always go around and ask people if they have want to give us updates so that
they're different PATs, and and they've all been very, very positive. I'm sure you guys have been
hearing.

[01:05:30–01:06:00]
directly about how that process works. Uh that that process works as well. Also, Lewis and I have um
been trying to attend the first meeting of any of these PATs so we can explain the bond oversight
committee's role in these meetings so that there is no questions or concerns about you know why are
you not speaking up, why are you not voting, and that type of thing. So we try to we attend those
first meetings so that we can make clear what our role is. Thank you, Kathy. Okay, so the fifth
charge is to provide uh advice to the Board of Trust.",0
33,1:06:00,1:08:00,"[01:06:00–01:06:30]
Advice to the Board of Trustees in a way to maximize the potential of the bond plans and to provide
the best value. Again, I said this earlier, there's no indication that uh any of the campus
replacement projects are over budget or significantly behind schedule. Um, as a committee, we're
extremely pleased with the level of detail and the time that they take from questions. Um we did
ask, and we shared with you last year, that we asked for feedback from staff as it related to
lessons learned on campuses. And I think part of that is uh the reason that that's important is you
learn on what

[01:06:30–01:07:00]
works and what doesn't work on on each each project. And as we look at future bond opportunities
down the line, we need to make sure that we incorporate future design and construction standards
and/or educational specifications, right? Whether the the faculty says this is not working or we'd
like to see this instead, making sure that that's being documented so when those standards uh get
readdressed at a next bond issuance, that that's taken into consideration. Because again, we all
remember that before the 2017.

[01:07:00–01:07:30]
bond started, there was a building standard so every campus would would be the same. So um go to
next two slides. I inadvertently left a slide in there, so apologies. But here's a summary of the
lessons that were learned from from the from the first uh presentation where we went over this. I'm
not gonna read all of these. Um but you know, we will continue to ask for this uh on a yearly basis,
and you know, that way we all have a a list of of things that need to be taken into consideration
for for future projects. So

[01:07:30–01:08:00]
project. So um that's that's that's really all I've got. If there are any questions for Kathy or
myself, we're we'd be happy to try to answer them. I don't have a question. I just have a comment,
Kathy, about the um fine arts vans or the buses that we have now. I don't know what we're supposed
to call them, but I went to pick up Tamales at my daughter's high school and uh the band was selling
them and she was raving about them. I mean they're just so she's a parent and she said I don't know
like you said how we've done it without it. I mean it's just been so great.",0
34,1:08:00,1:10:00,"[01:08:30–01:09:00]
Which has been so great. We got to go inside the bus. Yeah, there's a bus. Just to see how they
store the instruments and how they're protect you know, our investment as a district is protected,
is really um fantastic and really make will make a difference, I think, long term. And and how you
know hopefully how long these will last and and also just the the transportation. It's real and also
it's just a billboard for our district, which is also just a you know a definitely a bonus. So we
were very impressed and pleased that we got to take a look at these. I'd just like to explain.

[01:09:00–01:09:30]
I'd just like to express my appreciation for what y'all do. I I recognize the commitment. This is
one of the few committees that that actually spans the amount of time that uh you guys face. So if
I'm doing my math correctly, twenty eight quarterly meetings translates to seven years and you're
not done yet. So uh do appreciate what you're doing and and keeping us informed of of the uh updates
and the the the progress of the bond program. Well David, I appreciate that. I know you have a
little experience in our shoes. Uh and uh I remember you saying that it was the attendance at the
very end got a little a little light at times. And so

[01:09:30–01:10:00]
we we hope to uh to let you know that that won't happen with our committee. But thank you. Thank
you. Next item on the agenda is a discussion of legislative priorities. Dr. Blaine. So I'm actually
going to turn this over to David and Courtney. And do you all want to walk us through what you have?
I'll go ahead and get started with it. Just say uh first off, I want to say thanks to everybody that
that contributed some input to.",0
35,1:10:00,1:12:00,"[01:10:00–01:10:30]
Did some input to our priorities, just a lot of great input, but there seems to be a recurring
theme. We need more funding from the state. That seems to be the common denominator. I think one of
the things that we really want to highlight as well, and you touched on this, Dr. Blaine, in your
opening remarks. You know, as Spring Branch is going to continue to be a leading choice for parents
to choose for education, it's really important for us to have the programs, the academics, that
have.

[01:10:30–01:11:00]
makes to have the things that those parents are looking for. And so in our priorities, we tried to
recognize that that a lot of this is based on making sure that we've got the funds, we've got the
resources, and we have the control over that to be able to do what our community is expecting us to
do. So Courtney, you want to add on? Sure. I just wanted to add that David and I tried to condense
the legislative priorities so that we had uh fewer talking points. We've got five main talking
points with things underneath.

[01:11:00–01:11:30]
underneath. Just you know, taking into consideration um John's comments from last time about how
little time we have with the legislators when we are up there and how um important all of it is but
there are so many things that we are asking for. One last thing that I wanted to add is that David
and I have been reaching out with the help of our SFAT team to other trustees in other districts and
we are going to just form a committee to just

[01:11:30–01:12:00]
a committee to talk with each other about the best way to advocate for our school districts,
considering that each and every one of us was elected to do that to advocate for our school
district. So we're gonna combine with the other trustees and talk with them what works, what doesn't
work. Um in looking and doing our research, pretty much the entire state that has produced their
legislative priorities so far are very similar. We're all asking for the same thing, there's common
themes, and I do think the state.",0
36,1:12:00,1:14:00,"[01:12:00–01:12:30]
knows, but we will continue to ask and continue to get in front of them and let them know how
important this is to each and every one of us. Um, last but not least, please read through it. We're
gonna talk again and vote at our December workshop. So please give us feedback. All feedback to me
is constructive. Um let us know if there's anything you'd like to change, take out, add, anything
along those lines. So I think that's it. Thank you.

[01:13:00–01:13:30]
The next item on the agenda is a request for approval of the twenty-three twenty twenty-three-2024
audit. Do we have a motion? So moved. So moved. Second. It has been moved by Chris Ernest and
seconded by Courtney Anderson. Is there any discussion? Um I I just I guess want to acknowledge um

[01:13:30–01:14:00]
Some of the public comment. I've seen some of the Facebook posts and different things about this
issue. Christine, you and I had conversations about this today. But I guess what I want to say to
Christine is I appreciate your conservative approach to our finances. I think some people
misunderstand what the fund balance is and what it should be. But especially with all",0
37,1:14:00,1:16:00,"[01:14:00–01:14:30]
the uncertainty facing public education financing right now. I think it's really important that we
that we are conservative in our budgeting, and I would much, much rather be in the position where we
aren't spending as much as we thought we would have to rather than the alternative. I mean, we're
we're already uh struggling with inflationary pressures and things like that, and certainly we've
made some tough decisions in the last year, but um.

[01:14:30–01:15:00]
Um I appreciate your your approach to our financing. Anyone else? I'd like sorry. I'd like to echo
those comments. Um, Christina, I'm very appreciative for the work that your team and you did. These
every decision was excruciating, and every single one of us up here went through every range of
emotion on making decisions. Um I do find it extremely disappointing that former trustees.

[01:15:00–01:15:30]
don't actually understand the working budget and what what it means and what's going on. I do find
it very disappointing for false information to be put forward. To me, as a parent and as a trustee,
it's it's very disappointing. Um so I just want to reiterate and thank you for all of the work
you've done and your team. Those in favor say aye. Aye. Aye. Aye.

[01:15:30–01:16:00]
Those opposed say no. The motion is approved by a vote of seven to zero that we approve the twenty
twenty three-2024 audit. The next item on the agenda is a requ oh I'm moving, I'm tabling 7B till
after executive session. Sorry. The next item on the agenda is a request for approval of the
resolution of the Board of Trustees of the SBISD casting its ballot for the election of directors to
the Harris Central Appraisal District Board of Directors.",0
