chunk_id,window_start,window_end,text,binary_hit
42,1:24:00,1:26:00,"[01:24:00–01:24:30]
that we would put the nadatorium back up for a bond election the following year since we're fairly
convinced that that's the answer, or would we like you do you see what I'm saying? I mean, do we do
we then start renovating the softball field at Springwoods on the other end of campus because
nothing's happening? Or I just uh and we don't have to have that set in stone because there's moving
pieces the way we've decided to do it, and I think it's the right way to go. But well, I don't think
those projects really are set to begin anyway. No, we've got a couple years right now. Yeah. Yeah.
So and and we would go ahead, Travis. Well, we would obviously

[01:24:30–01:25:00]
if that unfortunately was to happen and the board would plan to go out for it to be represented to
our community, we would plan accordingly. So it could be that Chris, we're we're starting the
project, and by the time we get to where the field ultimately would lay, we would have a final
decision on that. So it's all about scheduling and phasing. So I hear you, Chris, and I guess since
last what was the last meeting? Thursday? Right, since since last Thursday, I've actually tried to
reach out.

[01:25:30–01:26:00]
Try to reach out and talk to a bunch of folks about this just to just kind of before I put anything
on social media, just to get a feel for hey, where where do folks stand? It's been pretty lukewarm.
Um and on the nadatorium, uh just to share kind of the feedback I've received is some people will
vote for it if it's there, some people will vote for it if it's there, some people will vote for if
it's there. But if it's not there, then I'm kind of wondering okay, do we need to try to nail that
down? What's what's the rationale for that? Like, because I honestly could care less where it is. I
hear you. I think it's",0
43,1:26:00,1:28:00,"[01:26:00–01:26:30]
so some some of the proposed sites were pretty far and I think you have some folks that choose to go
to what men's clubs or boys' clubs, dad's clubs. Um and that just might impact it, right? I mean I I
I think that's the right I mean I'm I'm not a I'm not a dad of a swimmer, but I think that's what
I'm hearing, right? John John, just to answer that question, I think part of it is the centrality or
the ease of access, because every every school high school will use that on almost a daily basis. So
access and transportation is a is a key part of that.

[01:26:30–01:27:00]
Yeah, it's interesting. I I don't know what's been your experience when you all talk to folks, but
like they like it where it is. But then it goes to the master planning of Spring Woods, right? Have
you has anyone talked to people at Springwoods? Do they want it to be moved? Yes. Well, I hesitate
to say that definitively, but I I think again, I I think some of that goes into the feedback that
you get from the principal. But I think I think they would like to understand, and it's just going
down the road, like what is

[01:27:00–01:27:30]
Is I think this benefits them down the road in terms of master planning of rebuilding the high
school, but that's down the road, so it's it's difficult to sort of consider that. You know what I
mean? Um but that said, I just I guess uh what I'm thinking of, and I don't know what would happen a
year or two down the road, but I wouldn't want the campus part of it to pass, and we get to the
point where we are actually renovating other high schools and Springwood softballs and limbo because
we don't know. I guess that's the bad scenario.

[01:27:30–01:28:00]
I'm I'm I'm a little surprised that you've gotten lukewarm reception because I've gotten just the
opposite. I've gotten resounding like, let's go, this is great, long overdue. So I'm not gonna say
it's all been I don't want it. It's I might want that, I might want that, but it's not this
overwhelming. And there have been a good number of comments of hey, I'm not seeing enough in here
that's directly in.",0
44,1:28:00,1:30:00,"[01:28:00–01:28:30]
That's directly impacting student outcomes. And I go, well, it's an athletic and fine arts, right?
But I think some of them are asking the question of, well, why don't we have a hybrid or why aren't
we perhaps putting some things in front of it? And you know, that kind of drove me down to another
rabbit hole, but I don't know if this is that many to talk about with respect to taxes, but maybe
that's later on in the conversation. I mean, I I I think the plan always was to look at to look at
our middle schools and and high schools in the twenty twenty seven or twenty twenty eight bond. That
was always kind of I guess the plan. Um so

[01:28:30–01:29:00]
So I I do think those things are being considered when we're doing this athletic spond. Um just
really needs to be communicated because the people that I've spoken to, that always comes up. I
mean, they all agree that we need to redo some athletics. I mean, that's there's no question about
that, it needs to happen. But they're like, Well are people gonna vote for the middle schools when
we do have all of these things that need to happen, you know? Well, see my theory on that is that
when we re when we decide to redo the middle schools in a few years, there's gonna be three or four
of them on there.

[01:29:00–01:29:30]
you're gonna have one or two high schools on there, and you're gonna be talking about a billion and
a half dollars. And so when you then put an additorium on there for 70 million dollars, it's gonna
be real easy to check the box and say no because it's that you're gonna now you're talking about a
two million two billion dollar bond all at one time. So the theory was is we did we did the bond in
2017, and then that was when I was fairly new on the board, but sort of the you know, redoing
Guthrie and the CTE improvements that we made was that for sure that board's view at the time, like
sort of the addend.",0
45,1:30:00,1:32:00,"[01:30:00–01:30:30]
like sort of the addendum to that original bond. And the only reason we didn't do those with the
2017 bond was because we were concerned about the overall price tag of the you know sticker shock of
going over a billion dollars. So this was, you know, I I I have less I'm less positive on the idea
that some of these proposals would pass if we had another billion and a half dollars worth of
projects on the ballot with it. And so the idea was is do it on its own. They have to stand on their
own anyway. We're gonna have three or four proposals as it is.

[01:30:30–01:31:00]
Uh, and then you know that you've got the big campus improvements coming in a few years. But they
already they were always coming in a few years. And that's a good and the tax increase thing, like
guys, we're way behind everybody in the state because we're afraid to do it. And quite frankly, I
just wrote a $40,000 check, and you're gonna charge me another $250 for this? Like, I'm all in. It's
literally meaningless. It's like it's it's pennies compared to what we're paying, and we're paying
more than anybody else in the state, and our facilities suck. That's what I'm tired of. So it's like
tax increase, tax increase.

[01:31:00–01:31:30]
Okay, well, it's 200, 250 dollars for me, and that's literally absolutely nothing. So, like, I don't
understand what we're scared of to say that. I'm not, we'll take it head on. You're afraid of paying
another hundred, hundred and fifty, two hundred dollars so that our kids can have world-class
facilities like everybody else around us. That's your prerogative, that's fine, but that doesn't
bother me. And when we do the bond in 28 to redo the middle schools, there's going to be a tax
increase. There's going to be. Like, we cannot keep up. We have so much work to do because we're so
far behind. It's almost inevitable that we can't.

[01:31:30–01:32:00]
avoid it at this point. Right. Because everyone else in the surrounding districts has been raising
taxes for for decades, but we didn't. So this just is the time that everything is falling apart all
at once, and now we've got to we've just got to do it. I mean it's I I understand where y'all are
coming from. What I dug into since last Thursday. Again, right, the curse of having more time to
look at this isn't always a good thing, right? But what I dug into last since last Thursday is so",0
46,1:32:00,1:34:00,"[01:32:00–01:32:30]
So the way this plays out, right, you look at the M and O and the INS, and I I'm gonna I might get
some of this wrong, Christine, but what I dug into is when you start looking at how taxes play out
and current legislation and how they might move our homestead exemption from 100 to 140, in some
cases 160. So let's just say we pass $650 million worth of bonds right now. It's gonna be at a
certain increase in tax. Okay? And I think what's occurred in the past is there's a hold harmless
because you passed it on the INS, there's a hold harmless because you passed it as

[01:32:30–01:33:00]
Because you pass it a certain tax increase. So we're gonna go to our constituency and say, hey,
listen, we want we would like for you to consider in piecemeal, but perhaps all of it passes, and if
all of it passes, it equates to X number of dollars with respect to taxes. You know, I think we
probably also need to communicate. Should there be a change in legislation, which is ongoing right
now, it could be that when we get to $160,000 in homestead exemption, I don't know if you all
recall, but when it went from $40,000 to $100,000, we lost people out of our taxable base.

[01:33:00–01:33:30]
Right? And so it's not just a matter of MO dropping out of recapture, which has its own
implications, but down the road, when we get to the next bond, right, that is really focused on
academic buildings, what I didn't realize, what I don't understand, but it's really given me at
least a moment of pause is we're gonna have the increase we have now plus whatever the increase is
gonna be because we have to make up for our lost taxable base. So you might say, hey, listen, it's
not a big deal to pay X number of dollars, right? Not everyone may think that way.",0
47,1:34:00,1:36:00,"[01:34:00–01:34:30]
Um we gotta remember those folks. But then next time round, we might be able to say with 50%
confidence that hey, next time around, when we go to $1.5 billion, it's not five pennies, it's ten,
eleven pennies. Well, we don't even know that now, right? Because we haven't seen the legislation
play out. And I know that's that's a that's a risk right now, but it could get to the point where
the real bond that we probably need to pass with academics won't have a chance. And I do worry about
that. And that is not a lens I had, even as of last Thursday, right.

[01:34:30–01:35:00]
I wasn't thinking about how this plays out tax wise. So I just want to make sure when we have this
conversation, right, we have that. And I'll tell you, I think where I arrived, I don't know, maybe
yesterday. If the sands are shifting underneath me in scope, sequencing, tax implications, man, I'd
like to get rid of the water tower and um you know put another field house in. It does beg the
question of okay, hey, listen, I want people to have their burgers, fries, and shake, right? They
have the right to choose whatever they want, drive through, buy it, whatever.

[01:35:00–01:35:30]
But I do feel part of our responsibility is to provide them the nutritional value so that they're
making responsible decisions. I'm not sure right now that we can with great confidence say, hey,
listen, this is how it's going to play out, because we're even talking about sequencing and location
now. And when we get to the next bond, this is what we're gonna see. I'm just sharing. Yeah, I know
I know, but I think that's the attitude that's gotten us so far behind. Like we're waiting.

[01:35:30–01:36:00]
Like we're way behind. Behind in athletics? No, everything. Everything. Everything. Athletics, our
middle schools need to be rebuilt. Yeah, we have a ton of things to do. So, yeah, there's gonna be a
tax. I guess that's my point. There's gonna be a tax increase. And I personally am of the opinion
that, like, there would be no greater facelift that you could provide to this district than to
improve the athletic facilities. I mean, there's not that there's nothing else that draws people in.
And whether people like it or not, like that is what people start to form an opinion on of the
school district and the confidence that they have in the schools and where.",0
48,1:36:00,1:38:00,"[01:36:00–01:36:30]
they're living, and if we don't have those things, like what do we have? Like, I'm tired of paying
as much money as I already do pay. And then when people come here and they're like, This is spring
branch? This is y'all's school, this is this is this is what y'all play in? Because you look around,
and I fully intend to just show everybody else what's around the state. Like everyone else is doing
it. So when are we gonna do it? When are we gonna do it? And if you don't do the athletics now,
you're gonna do it in ten years? I mean, so like we're talking about like totally standard.

[01:36:30–01:37:00]
Like Tully Stadium, which literally we're bringing in porta potties and having you know stairs
collapse and the berm caving in on the on the dairy Ashford site, we're gonna do that in 12 years?
So for our kindergartners, they might be there. I just like it's just like when are we gonna do
these things? So I just I'm of the opinion like we've got to be more aggressive in how we attack
these things. And when you start to look at the tax, like it's not that big of a deal. And everybody
else is doing it and increasing taxes and paying it. And I know that that's not a popular thing to
say, but when you talk about the actual dollars and what we've got and what we're paying relative to
what everyone else

[01:37:00–01:37:30]
in the state has. Like, I mean, you talk about competing all the time. Like, look at all the private
schools around Stratford and Memorial. I talked to Ray Morris Barnes right there a few weeks ago at
the community meeting, and he knows the first thing he said was Stratford America is 110% behind
this entire bond. I will do everything that I can do to turn Stratford out to vote for this thing
because when I have prospective families come in, the first thing they want to look at is the
athletic facilities. That is what I take them to, and right now that happens to be his weight room.
He takes them there first because that's what they're most proud of.

[01:37:30–01:38:00]
Of and that's what can compete with Kincaid and Houston Christian and St. John's, and like that is
what is important, and that is what people see. I was at a Spring Branch Middle School Memorial
Middle School game just a few days ago. There were 400 people in there. The gym was packed. What
else has Memorial Middle done other than a program that brings that kind of people in from different
parts of our community? It's they're very important. And when you look around, you start looking
around those gyms. I was at uh I was at Northbrook Middle on Sunday or Saturday or Sunday doing team
pictures. That gym sucks. It sucks. You look around.",0
49,1:38:00,1:40:00,"[01:38:30–01:39:00]
and it's like, what I would I wouldn't want to play in there. I wouldn't feel confident necessarily
about sending my kids to school. Like, you can't help but form an opinion of it based on why you
look around and like, what is this? And then you just drive 20 minutes down the road. It's like, why
am I paying $35,000 in taxes when my kids could play in the Taj Mahal 20 minutes down the road? But
I think we're all interested in keeping our property values high. We love living in this community.
We love the value that we have. We need to invest in it. And if that means that I'm paying another
$200 or a thousand more dollars, then I'm all in. I'm already paying a ton.

[01:39:00–01:39:30]
So why would I pay a ton and have you know Chris? I hear you. I'm not saying I'm not saying we don't
do this. I'm just saying we gotta get it right. I know, but I hear the the the the the I I don't
know the the right words not catching, but like we've got to be aggressive. I think what you're
hearing is hey, there's there's some pause and resistance. Taxes are going up. There's nothing wrong
with that. If we do this and we do our middle schools, taxes are going up. We're talking about a
huge investment. Um I mean, I've I don't know how many times I've heard recently, just in today's
meeting, hey, we've moved pretty fast. I get it, right? I'd like moving fast, I want to compete.

[01:39:30–01:40:00]
I just want to make sure we get this right and we sequence it right and our taxes are given due
consideration and we really look at, I mean, even demographics, right? Can we open up a new space
for the nadatorium? And then do we have our bonds correct? I mean, when I'm beginning to ask all
these questions and we're two two weeks away from taking a vote, I'll just simply ask, hey, just
they did that last putting it, right? There's always questions that the size of this has gained
momentum as we've gone through the exercise. And I think what I we talked about this before. I no,
no, I won't interrupt you again.",0
50,1:40:00,1:42:00,"[01:40:00–01:40:30]
But like when we started, when we started, it was there was no idea what we were even getting
ourselves into. And that's also happened with every other bond. CTE, the 2017 bond, all of them
started at one number and increased three to four times when they took the vote. So so I I can
provide a little different information on that, but to to this one, the conversation started as I
recall was we do something narrowly focused, something quick. We can address some needs that we have
uh very quick and really not.

[01:40:30–01:41:00]
even impact in any substantive way the next bond rhythm that we have, which would be the 27 or 28
with the with you know high school projects, with middle school projects and all that. The the
number, nobody was saying at that point in time a number, other than we were just offering a for
example, this is what 200 million would do. But my concern is that as we have gone through this
process, we've engaged experts to go in and do an assessment, facility assessment. They came back
and they said, listen, here this assessment says one priority.

[01:41:00–01:41:30]
absolutely got to take care of these things. Another priority, while you're touching something,
there's a good rationale for doing something else with it. And the third priority in that was to be
able to do do things that you could sort of above and beyond it would be great while you're doing
this. So all of that together then became a number. And back in in our December meeting on December
13th, that priority item of just the the basic priority was barely over a hundred million dollars.

[01:41:30–01:42:00]
I don't remember that. And so I I I mean I've got some information. But right now, as we sit here
today, using the all of the facility assessments that are going into the items that are making this
list up now, the priority one items are are hovering a little below 200 million. And so my question
is, Chris, is not should we, but are we are we focusing on the things that we need to, or are we
going beyond what we really need to?",1
51,1:42:00,1:44:00,"[01:42:30–01:43:00]
and and to a magnitude now that it's going to potentially do what we said in the beginning we didn't
want to do which was interfere with what would be the next package and and i i I've heard all the
arguments the pleas the passions for being aggressive take it now we won't be able to do it in the
future but if we're talking about you know the master plan for memorial high school would a
competition gym be picked up in that master plan spring woods not even in the master plan so I but
Spring Woods has got a master plan exercise that has to start yet in terms of that so I don't know

[01:43:00–01:43:30]
that all of these would necessarily we'd say today or never, but I do think that we need to be
showing a little bit of restraint because we do have more things that need to be done. And not I
mean, while you while today you say athletic facilities is our utmost priority, but as a district as
a whole, I don't agree with that. I I agree they're important, but I don't feel that that's our
highest priority. Well I want to weigh in on that point because we had a public speaker tonight who
mentioned

[01:43:30–01:44:00]
um who mentioned you know our academic facilities are more important and we should be focused on
that but you know when I first got elected we we um conservatives um were really railing against SEL
and that we didn't need to be in the business of you know social emotional learning and things like
that to me what SEL was or should what SEL should have been which I think we've tried to move in
this direction is I call it school spirit and it seems",0
52,1:44:00,1:46:00,"[01:44:00–01:44:30]
kind of a silly concept, but I personally believe that when our high schoolers and middle schoolers
are involved in extracurriculars, whether that's fine arts, whether it's athletics, whatever it
might be, that is their driver, if you will. I've heard Stephanie Michelle talk about at Springwoods
when you have to, when a kid arrives at at high school and they can't read and they have to go into
some kind of remedial reading English type class.

[01:44:30–01:45:00]
Class, and that takes up their credit, and then they can't do football or they can't do dance or
band or whatever, then they lose interest in school. And so she talked about how that was a force
multiplier of a bad student academic outcome. Because now why do I want to go to school? I can't do
the thing that I like the most. And I think our athletic facilities, our fine arts facilities, those
are all things that bring that. I want to go to school today, I have to go to school because I can't
go to practice.

[01:45:00–01:45:30]
if I don't if I'm not there for all the periods of the day, I can't play in the game, if I don't go
to school. I mean, I had that conversation with my kids all the time. My daughter just the other
day. I don't feel good, but I need to go because I've got to go to this practice and I have to be
there for X amount of time. So in full respect to that though, I I I understand the advantage of
having some good facilities, having kids be able to participate in those programs, as as it would
help their overall academic success. My question and my concern is does it take six hundred and
fifty million dollars to accomplish?

[01:45:30–01:46:00]
that. Yeah, it'll be $800 in a year. It's not going to get cheaper. Like, I mean, time is money, so
if we don't do it now, like if you don't like Tolly Now, you're not gonna like it in two or three
years. You know? I mean, it's not getting any none of our issues are getting any cheaper. So so the
six hundred and fifty million dollar number in three years, but would more likely be ten years from
now, because I now know how this works, it's gonna be eight or nine hundred million. It will. And
then they'll really be falling apart. I mean what's left of it.",0
53,1:46:00,1:48:00,"[01:46:00–01:46:30]
What's left of them? Right, and I guess I I guess one thing I'll throw out there. I get it, Chris. I
mean one thing I'll throw out there is where do you want the higher tax rate on? Do you want the
higher tax rate on this scope or the next scope? It doesn't matter. It all has to be done. It all
has to be done, John. It does matter, Chris. It all has to be all the projects have to be done
though. The you you wanna you wanna optimize how you play your taxes out. I mean won taxes on one
point five billion, very different than taxes on six hundred and fifty million, especially after we
lose a

[01:47:00–01:47:30]
taxable base in this neck of the woods, right? I mean that that that's legitimate, right? And I have
to admit, I was not I had not played that out. I had not really looked at that. I had to call
Christine up and said, hey, how does this really work? Right? So that I'm just sharing information,
folks, right? Well, and maybe in and first of all, I I I am kind of loath to make decisions based on
the clowns in Austin. I mean, you know, everything changes on a daily basis. We get promised this.
They never they never come through on their promises. So I you know, we we've scrolled.

[01:47:30–01:48:00]
you know, we we've screamed and screamed about we can't budget when they don't tell us how much
money they're gonna give us and no one cares. So um I I appreciate your point and and you know
because these projects do take several years um to plan, to build and all the things, you know,
maybe it is that if if those things happen and with the homestead exemptions and things like that,
well then maybe we break our twenty twenty seven, twenty twenty eight bond, you know, into two
parts.",0
