chunk_id,window_start,window_end,text,binary_hit
87,2:54:00,2:56:00,"[02:54:00–02:54:30]
24 11th graders this year versus historically? Um and and I'll check because I'll double check that,
but yes, we have had an increase in that number. Okay, thank you. Ms. Flowers, we come back? Linder?
Thank you. Um really great, very thorough presentation. Thank you again. And as thorough as all
these questions have been, um, I want to just dive a little deeper into this slide on figure eight.
Um, could you speak more um to how how we are going

[02:54:30–02:55:00]
to address the gap between math and reading in our TSI readiness. I didn't really pick that up in
the um the summary of you know actions taken. Could you speak to that please? Yes. Um I don't want
to sound like a broken record, but I do think it's again it it is gonna continue to be building and
and offering high quality grade level instruction in the years as they progress, right? And so I
think over time um math was hit really hard in COVID in particular because they lost that
foundational math. Um and for TSI readiness again, you really need

[02:55:30–02:56:00]
that, you know, if you didn't learn fractions well, you're it's gonna be really hard to do well on
these really advanced assessments, right? So really making sure our students have that strong
foundation as they come in. I think the other thing that we haven't actually talked much about yet,
but if students are behind, um they are getting that additional remediation support in ninth and
tenth grade in those earlier grades. So more minutes in reading and math to focus on higher to make
sure they have high quality instruction and more time to catch up. Um so there is a higher and a
stronger focus on remediation.",1
88,2:56:00,2:58:00,"[02:56:00–02:56:30]
for our students who are behind, especially in ninth and tenth grade, which is critical given that
this test occurs in 11th grade. So that's another way in which we're catching up the students who
are behind. Yeah, and if I can add, so we were really happy that our math scores on the STAR
increased pretty significantly this year. And one component of that was we also really had a good
focus on ZERN as an additional supplemental intervention besides the NAS model. And those early.

[02:56:30–02:57:00]
grades will will build so that when we get to 11th grade, we'll we'll do much better. Just following
on that to better understand maybe something I think was asked before, what else can we do for our
students that are already like ready to exit the system? And so they're not they're not at that
level of achievement yet. Um we we want to give them more. Um what other opportunities or maybe what
other asks do we have of our community around things that we can help in addition to that? Um
anything there you could speak to?

[02:57:00–02:57:30]
to elaborate there? Um well the I think the the district wide strategy is ensure full access and
preparation for the SAT because it is we have invested in ensuring all kids can sit for that that
test. We pay for that test for everyone, um, and we actually are moving, uh we we're gonna take that
test at the very end of April uh this year, and that and historically we've taken it in early March.
So we're even gonna give our kids a little bit more time to prepare. Um and so all kids should get
access to SAT preparation and support, but I think.

[02:57:30–02:58:00]
the point here is we don't want to give up on the kids who don't meet the threshold after they take
it in the SAT. So we do a number of things in 12th grade. Um they take the TSI specific College
Bridge course, which specifically focuses on helping them support TSI. Um, and then after they take
the course and complete it, they can sit for this uh assessment again. Uh, and and they can take the
TSI 2.0, which is the Texas version of the SAT. It's faster, it's easier for them to take. We can
offer it a lot more. Uh and so they can we can focus on taking um.",0
89,2:58:00,3:00:00,"[02:58:00–02:58:30]
On taking that. During that time, actually, we our team will offer numerous Saturday preparation
sessions that are optional, but we do have a lot of kids, we have kids that show up at all of them.
And we just find other ways to find time outside for those kids who we can get to further support,
especially the kids that want to go to college and want to meet that threshold, so that they have
other opportunities for engagement and preparation. And so we did a good number, I can get the exact
number of Saturday sessions last year, and we do plan to do that this year for that additional in
person preparation.

[02:58:30–02:59:00]
support. And we just don't stop. We continue until they graduate helping them. Thank you. Ms.
Arnold? Yes, thank you. I I know we won't see it in the data here because of the implementation of
the policy is so new, but eventually will we see an impact of the auto enrollment in more rigorous
coursework show up here in the data? That would be the hope, yes. So one of the things we do from
our perspective is when we're looking at college credit, our teams own accountability.

[02:59:30–03:00:00]
metrics really focus on both access and whether or not they earn the credit. And so on the access
side, that's particularly where you would see the opt-out policy really take a play here because
students would be auto-enrolled. It's not just that piece, we also have to really support the
scheduling of that. So, you know, a campus has to have enough teachers to teach the extra additional
advanced courses. And so we really work on that side of it too. But yes, we would expect to see it
in the data. And even this year, with",0
90,3:00:00,3:02:00,"[03:00:00–03:00:30]
Without that policy, we have seen significant increases in access just because we've been paying a
lot of attention to it and again focusing on that. So students were already scheduled when this
administration started, but even at the semester, we enrolled a lot of students actually in dual
enrollment semester courses because this was a big priority for us. But yes, we should see it in the
data match. Wonderful. And speaking of access, I want to follow up on a um question that Roland and
Mr. Martinez had with respect to the access of courses for students. Does the I understand the
district provides the

[03:00:30–03:01:00]
PSAT to all 10th graders. Does the district actively use its AP potential data to you know one
identify students but help build out courses in schools for students? Because if you're unaware, the
AP potential data helps through that data can help identify which students would do well in certain
advanced courses, and oftentimes that helps find students who are traditionally overlooked and
underserved. Yes, our opt uh out policy it does include the use of the PSAT to identify students who
should be moving into advanced coursework, and that's

[03:01:00–03:01:30]
Advanced coursework. And that starts as early as even in fifth grade because we are really looking
at the advanced math pathways in middle school now. And so both we're even piloting schools offering
all students in the school will be on an advanced math pathway. We're piloting that this year. So
yes, the PSAT data is used to identify those students who should be enrolling in their next course
as an advanced course. And we're also using this methodology as early as middle school to support
and join students who are at the most rigorous course available to them. That is fantastic.

[03:01:30–03:02:00]
I know the majority of districts across the country are not utilizing that data. So that's a great
strategy, and I'm glad to hear the district is employing that. Ms. Bandy? I had a question about the
PSAT too, so that was funny. I was getting my question together, then I heard you say it. So which
students are taking the PSAT? Who's taking that in our district? 10th uh well, I can look up exactly
who's taking it, but we offer it in uh tenth grade for everybody. For everybody. Okay.",1
91,3:02:00,3:04:00,"[03:02:00–03:02:30]
Okay. Um back in the day when I was in middle school HISD, certain students had access to take it in
the eighth grade. Um, GT, Vanguard, whoever, but and and I and I understand that some things have
changed probably about the PSAT and national merit, you know, um eligibility and things like that.
But um so maybe I'll I'll get with you all offline just to understand that process because I think
you uh I knew some eighth grade yes, some eighth graders were definitely taking it before. Um I also
had a question.

[03:02:30–03:03:00]
around what is there space and and what does it look like for a student to pursue an IBC and be on a
college path? Um my dream for my children are to be a mechanic, florist, and a cosmetologist by the
time they graduate from HISD and go on to college. So I'm trying to figure out what what does that
look like for a student who, hey, I want to have a hobby and maybe a career like this, and I want to
do this. What does that look like? Um

[03:03:00–03:03:30]
I think they can just choose in their course scheduling. Well, it's two things. One, we need to make
sure schools are providing both options. But there's a couple ways. From a college credit
perspective, you can take the more advanced versions of your core courses English, math, science.
And so students, particularly those again who are on that trajectory, will auto get auto enrolled in
those more advanced classes, and they can build their path towards college that way. And then they
can use some of their additional time to choose an IBC path.

[03:03:30–03:04:00]
But the other really important thing we're doing is we're working to integrate that college
coursework options into our IBC path. So, particularly for our IBC programs of study, we're we're uh
we actually have multiple meetings with with higher ed institutions where we sit down and we say,
Okay, what courses that do we have that are our CTE programs of study can we crosswalk with courses
that you all have so a student can actually participate in a program of study and be earning college
credit at the same time. Um and so we're integrating a lot of uh college credit opportunities into
our IBC programs as well. Okay.",0
92,3:04:00,3:06:00,"[03:04:30–03:05:00]
Okay, thank thank you. I think that a lot of times at least it seems like a perception because we
have different subgroups doing different things and it has to be an either or and I and we know
that's not the case. So that's that's great to hear. Um let me see. One other question I just had
about the data on um TSI readiness in the 11th grade, and that reading and math level that's um kind
of lower than what we like. What is are these tests that the students take?

[03:05:00–03:05:30]
in the 11th grade actually 11th grade level proficiencies, or are they, you know, I'm I'm trying to
understand like what grade level do they have to be proficient at to do well on these tests? Is it
11th grade subject matter? Um the it pulls standards from across grades, but the SAT does include
standards from algebra 2, um, which is typically a course students will take in 11th grade, uh,
which is also one reason we pushed it back a little bit this year, but it doesn't exclusively cover
algebra two.

[03:05:30–03:06:00]
Algebra to. And then the SAT thresholds don't change whether you're in 10th, 11th, or 12th grade.
It's a threshold that's set for college readiness. And so for the SAT, for example, they'll set the
score threshold in reading and in math, and that won't change. You have to meet that whether you
take it 10th, 11th, 12th, you know, whatever grade, because it's a it's a college readiness
indicator. And so we really work to support, you know, it's kind of part of why we give students
multiple at baths to be to make sure everyone can take it in preparation in 10th grade, everyone can
take the actual SAT in 11th grade, and then people can still work towards TSS.",0
93,3:06:00,3:08:00,"[03:06:00–03:06:30]
work towards TSI readiness in 12th grade. Our students can if they if they haven't yet achieved it.
We're also really mindful of over testing though, so we try not to test any if you if you've met the
threshold in SAT, you're done. You don't need to could continue to do that that additional work in
12th grade. And is that the same as far as the algebra 2 and the English three? Does the the the
TSIA also cover algebra 2 and English III as well? Okay. In both, yeah. Okay. And and I I you said
that we pay for these tests. What if a student because I can

[03:06:30–03:07:00]
remember this when I was in high school too. Sometimes you kind of take it again to see if you can
do better. Do we pay for multiple SATs? I think there may be some exceptions where we do. We don't
offer a second district wide test, but I'll check on that for you and get back to that. Just
curious. Okay. Thank you. Thank you. Okay. Let's thank you for that presentation. Oh, thank you.
We're gonna do uh goal four. Thank you.

[03:07:00–03:07:30]
Good evening. Um, I'll be presenting on Goal Four Progress Measure students in grades four through
eight who receive special education services that achieve growth as measured by Domain Two, Part A,
of the state accountability system will increase from sixty-three percent in August 2023 to 78% in
August of 2028. And you can see

[03:07:30–03:08:00]
that the district did meet this goal measure. In fact, we exceeded our expectations for this year.
And at the end of the year, 66% of our students with disabilities in grades four through eight
achieved that growth measure. Growth point is awarded by comparing the student star performance in
the previous year to their performance in the current year. And so students are counted in this
report if they earn that goal progress measure in reading or math in this report.",1
94,3:08:00,3:10:00,"[03:08:30–03:09:00]
And so you'll just see the various subgroups or student groups in this chart that shows exactly how
those students those student groups performed. And so you'll see all student groups were able to
meet that target, except for our Asian and to race, which you can see in the right hand in table
two, that those numbers are pretty low in our students with disabilities.

[03:09:00–03:09:30]
Broke down into further. So in figure two, you're going to see the comparison again of that growth
progress measure by all students with disabilities and their student groups compared to their non
disabled peers. And so that's where we're always talking about the achievement gap, closing the
achievement gap between our students with disabilities and their non disabled peers. And so we're
constantly looking at that information and continuing to work on different strategies to close.

[03:09:30–03:10:00]
that gap. In Figure 3, you'll see the same information but a comparison across NES campuses and non-
NES campuses. So you can see overall students with disabilities at NES campuses did achieve more
growth than their non-NES peers, except in the group of white and Asian. The figure four, you'll
also again just see the same information, but it's a comparison of reading.",1
95,3:10:00,3:12:00,"[03:10:00–03:10:30]
and math. And so when you look at students who made that growth point in reading and math, you're
seeing that that most students had achieved that growth point in math where it was lower in reading.
I'm going to come back to this and continue through the data and then I'll come back to the root
cause analysis. But goal point progress measure 4.1 and 4.2 and 4.3 actually feed.

[03:10:30–03:11:00]
into our larger district goal of meeting that con meeting that growth measure. And so 4.1 is the
percentage of students in grades four through eight who receive special education services that meet
that conditional growth of 0.6 or higher on the NWA map and reading. And so our students at the end
of the year because this is the first or last year was the first year that we had the NWA map

[03:11:00–03:11:30]
WEA mAP At the end of the year 28% of students with disabilities met that goal progress measure.
You'll see in figure six that there's the comparison again of our students at NES campuses versus
non NES campuses. In the next table three, again you'll see that chart where 28% is our end of year
goal.

[03:11:30–03:12:00]
And so really just re-establishing that target so that we can continue to work with our students in
this area. In figure seven, you're also going to see that again, that comparison of students with
disabilities and their non-disabled peers. And again, this is about the growth measure. So students
who with and without disabilities who met that growth measure. And so looking at that chart, you can
see that our students with IEPs.",1
96,3:12:00,3:14:00,"[03:12:00–03:12:30]
actually achieve pretty well at that same level at the same rate as their non-disabled peers. This
is so we just looked at reading and now we're looking at the math. The same goal for math that we
will increase from our baseline this year is actually 27% of our students with disabilities met that
conditional growth measure. And so again, you'll see how.

[03:13:00–03:13:30]
How that can those students compare from the NES campuses and the non NES campuses in the area of
math. In math, you will see that again, just those student groups broken down, and then a comparison
again of students with disabilities against their non disabled peers. And you can see that there is
a bigger gap between the math than there was in the reading on the condemnation.

[03:13:30–03:14:00]
on the conditional growth measure. In goal progress measure 4.3, this actually is measuring the
students who were projected to meet grade level in reading or math in NWA math. And so that we had a
lot of discussion about this I think last time when this goal was presented because if you meet
grade level you're projected to meet the STAR standard. And you'll see that",1
97,3:14:00,3:16:00,"[03:14:00–03:14:30]
our students actually outperformed our expectations that we wrote for them at 19%, even though that
number is low, 19% of our students actually were able to meet that progress measure, which then
informed why we made the we're able to make that growth measure in the overall goal. And so again,
you'll see that same data broken down of students with disabilities compared to their non-disabled
peers.

[03:14:30–03:15:00]
Disabled peers. Again, this is where really where that achievement gap is between students with IEPs
and students that do not have IEPs. In Table 5, you're going to see that all of our student groups
met that growth measure or met that projected reading level in reading or math. And then you'll see
the breakdown from NES and non-NES students, as well as a comparison of

[03:15:00–03:15:30]
of reading and math. So, you know, we've sorry, I'm going the wrong way. So we've talked about
really, you know, what are some of the root causes of why our students who have disabilities aren't
performing as well as their non-disabled peers. And so again going back to that high quality
instruction in the classroom and then focusing on that science of reading as well as our teachers
are going through the reading

[03:15:30–03:16:00]
academies with the general education teachers in those grade levels. We also really have put been
focusing on specially designed instruction with all of our teachers and trained our campus
principals as well as our special education teachers at the at the onboarding back to school on what
does high quality instruction look like for special education students in the classroom. In order
for us to",1
98,3:16:00,3:18:00,"[03:16:00–03:16:30]
continue to increase at this growth rate. We definitely want to make sure that all our students have
certified teachers in front of them. So HISD increased salaries of all our special education
teachers across the district, and we're able to fill those positions. We're continuing to provide
that professional development of specially designed instruction. Our principals are conducting those
classroom observations and providing those actionable.

[03:17:00–03:17:30]
Actionable steps that we train them on during our trip back to school training, and we're continuing
to monitor the progress on the IEP goals and objectives. One of the things that we did in the last
PD day was we spent a lot of time back to school going over how do you develop a good goal and
objective for your student specific to their individual needs. And then this time we had open labs
for our teachers to come in, and they actually were able to sit down with

[03:17:30–03:18:00]
division teams that they brought in their next their students' data for their next annual R so that
they could sit down and be elbow to elbow and help develop solid goals and objectives for our
students as we go into the school year with a big focus on instruction for our students with
disabilities. Again, we're continuing to monitor all of these interventions and needing to adjust as
necessary, and we'll continue to do that as.",0
99,3:18:00,3:20:00,"[03:18:00–03:18:30]
we continue to um you know look at our students' data and how they perform. Thank you for the very
thorough report. All right, before we go to the next report, um do we have questions from board
members? Yes, ma'am. Ms. Bandy. I was just gonna ask about the two plus subgroup, student group. I
hadn't seen that in all of our um, you know, each one of our goals that we've been monitoring. Just
curious as to uh the significance of that subgroup, I guess, for this particular goal, because I'll

[03:18:30–03:19:00]
Goal because I also notice that we don't necessarily we see them in the chart, but we don't
necessarily see them in the bar graph. So can you just expound on that subgroup, please? I don't
it's it is not very many. I'll have to get the exact number. Um I think it was on one of my other
charts. Let me see. Uh 90. There's 90 students. Two or more races. I mean we we have and uh we have
an other uh

[03:19:00–03:19:30]
Charts talked about students with two or more races. Okay. Nothing, Miss Arnold? Ms. Linder? No? Ms.
Flowers? I'd like to talk about your learnings and communication between NES and non-NES schools and
some of the wins. So I know there are things that we can't replicate, like class size or like the
amount of teachers in the classroom, but one of the things that I heard

[03:19:30–03:20:00]
from teachers where it was working was the fact that the schedule and the timing and the way that
the that the schedule was created allowed for slash forced set time for teams to work together, and
that that was particularly crucial for SPED teachers to have that time with the teachers to improve
instruction. That's you know, that's not necessarily a price issue. So, what about those wins that
are happening for students in NES where there's not a",0
100,3:20:00,3:22:00,"[03:20:00–03:20:30]
cost associated with it. Have you started to look at those learnings and can then communicate back
and forth about the things that that maybe those other principals really need to lean into? Yes, um
great question. One of the things that Chief Hole and our team are working really closely together
as they were developing the curriculum and looking at the scaffolding moving forward and not just
for NES but also moving you know for the non-NES schools

[03:20:30–03:21:00]
NES schools as well, focusing on how can students utilize designated supports in those classrooms,
whether it's NES or non-NES, and that they can use those designated and creating those designated
supports so that they can utilize those within the assessment. The other piece to that I think is
our special education team as we look at the different schools and principal campuses just received
their lead evaluations, principals, and they had

[03:21:30–03:22:00]
some of them had action plans that they had to create that had to do with high quality instruction
for special education that requires them to, and whether it's NES or non-NES, they have to provide
that spot observation with specific actionable feedback. And so our teams are supporting our
principals with that. So no cost involved, just really trying to be strategic in how we provide
feedback and focusing on that quality instruction now that we have those.",0
