chunk_id,window_start,window_end,text,binary_hit
15,0:30:00,0:32:00,"[30:00–30:30]
All the fine arts and 100% certified teachers that I am evaluated honestly by a legitimate
evaluation tool. Wait, that is not a dream. It is a reality to me at my new school district, not
HISD. All of it is true. I was even evaluated as a distinguished teacher last month. HISD parents,
students, and teachers deserve the same. The community must remain skeptical and critical and, above
all, engaged. Only the community has the power to make dreams come true for HISD, not a committee.

[30:30–31:00]
Thank you. Thank you. Our next speaker is Jay Sizic. Sorry. Sidjik. Sidjik. Okay. Okay. Everyone
hear me? Yeah? Uh try again. I can speak really loudly anyway, so. We must rouse the sleeping giant,
the public. Our superintendent, he's irrelevant. This isn't about him. He's small. This is about us,
the collective giant. So to all teachers, staff, students, the city of Houston.

[31:00–31:30]
and even Mayor John Whitlismeyer, we must treat livelihoods as lives because then we can finally
realize that we have been fired upon and the casualties are in the thousands and thousands and
thousands. A Houston massacre, our Boston massacre. Therefore, this isn't a series of school board
meetings, but escalations to war, a Houstonian revolution in the defense of Houston's independence
in our independent school district, and for public education as we know it, now and for future
generations. Teachers, it doesn't matter if you resign or flee to another school. This is our

[31:30–32:00]
war. It knows no boundaries. Staff, you're gonna be thrown out before the holidays again. This is
our war. It knows no morality. Students, your lives are not going to get better. This is our war. It
knows no humility. Help us. This war affects us all. Any s no educator is safe. Thank you, sir. No
employees secure. Sir. NES, no education for students. Thank you. Our next speaker is Guy Buford.
Mr. Buford. And if the next ten",0
16,0:32:00,0:34:00,"[32:00–32:30]
And if the next 10 speakers, so numbers 12 through 22, don't mind coming forward, that'd be
appreciated. Thank you. Yes, sir. Good evening. My name is Guy Buford. I've been teaching. This is
my 34th year of teaching, and my salary has been cut. You got the paper in front of you? It's been
cut. It's like before you came, I was making $81,000. The year that you came, I made $90,000. This
year I've been dropped always down to $71,000. It is. And it's it's it's a shame. It's like you took
my $34.

[32:30–33:00]
Took my 34 years, well my t 20 something years, and you just threw them out the window like it
didn't matter to me. And you know you do you know how many days I I came here in 2015 and I have
probably missed five days. I probably missed five days. But for you to take the years that we have
worked and earned so forth, and you just throw them away like they don't even matter. And I worked
every day. And it is sad. Please give me my years. You have the power to give me at least.

[33:00–33:30]
Thank you, sir. Our next speaker is Victoria Fredet. Good evening. I'm here to address the same
eighty hundred eight hundred and seventy million dollars in HIC spending that was done without the
required board approval. I cannot say this better than the first student that spoke today, but I'll
read my speech anyway. Mike Miles says, oops, but it's fine because no laws.",0
17,0:34:00,0:36:00,"[34:00–34:30]
were broken. This puts the bar of acceptability, accountability, and integrity pretty freaking low.
But what can we expect given the last year and a half of complete chaos under the current district
leadership? Not to mention when this current board vice president himself is currently being sued by
our federal government. Board, I implore you to raise the standard and hold Mike Miles accountable
because even though he doesn't think so, this is a big deal. I do have a dream that we'll soon all
wake up from this nightmare. Our community students and our teachers deserve better.

[34:30–35:00]
Thank you. And I'll let Mr. Martinez join us. Okay, our next speaker is Sarah Maller, number
thirteen. Is the mic on? Okay. I'm Sarah Maller and I have two kids in HISD, and I have a dream. I
have a dream that our district will rise above the shadows of mismanagement and financial
recklessness. I have a dream that we will reclaim our schools from the hands of Mike Miles, who
spent nearly a billion dollars without the approval from the school board. We stand at a crossroads
where transparency and accountability must guide our path.

[35:00–35:30]
forward. I have a dream where an elected board of managers takes back control, ensuring that every
dollar is spent to benefit our students and our community. I have a dream of an HISD where we can
unite to pass a transparent bond that prioritizes children's education. We stand united in front of
you to demand change to restore integrity to our district. Let's make this dream a reality. Thank
you. Thank you. And I'm thinking we have a student here.

[35:30–36:00]
um Sophie Grace Rojas. You ready to speak? Okay, come on up. Oh, Sophie. Uh hello. Oh. Hello, my uh
hello, I'm Sophie. I was in an NES school where I only did AI worksheets where I didn't even
understand what I was learning. Any um but I don't I don't do that anymore. I have moved to a new
school that is non-NES, and I'm doing great. Now",0
18,0:36:00,0:38:00,"[36:00–36:30]
Now I get to have fun while doing my work. Here I wrote a song for science class about push and
pull. Um I have to find it. I'm sorry. Um I might break your eardrums while seeing this, but push
and pull is a force we be, help us move things easily. Push away or pull things near, forces move
things here and there. Pull your chair to take your seat, push your pen to make a beat. Push and
pull, they help us see how we use them simply.

[36:30–37:00]
Poule rope or push a ball, these are forces big and small. Thank you. Okay, our next speaker is
Maria Soto. Miss Soto? Speaker number fourteen. Miss Soto? No. Elizabeth Chapman number fifteen. A
year ago, I spoke sometime.

[37:00–37:30]
Hold on, I don't think your mic's on. Pull it closer if you don't mind. Okay, let's try again. A
year ago, I spoke to you in my capacity as a teacher in HISD for more than a decade. I attempted to
call your attention to the way that the district's policies were driving away experienced, qualified
educators and making it difficult to recruit and hire new ones. Today I'm addressing you as a
parent. My five-year-old daughter at Coulter Elementary has not had a teacher in her kindergarten
class for eight weeks. It appears that she will go the rest of this academic year. Seven out of

[37:30–38:00]
ten months of instructional time with the substitute, leaving her and her classmates with
significant deficiencies in their learning at a vitally formative time. You got this. I'm returning
to you after this time to implore you to rethink the practices that are denying my child the
education that she is owed. I have the resources and privilege to compensate for the way that she is
being changed by the district, but thousands of other parents whose children are being affected in
similar ways.",0
19,0:38:00,0:40:00,"[38:30–39:00]
Thank you. Oh, okay, Miss Soto? Yes. Yes. Come on up. Thank you. Yes, ma'am. Good evening. I am
reading an extract of our advocacy group teacher.

[39:00–39:30]
and staff exit survey. A toxic work environment can have a profound impact on both personal well-
being and professional productivity. Facing constant negativity or overwhelming stress, it erodes
morale and leads to burnout. A culture of poor communication, favoritism, or lack of support stifles
collaboration. I have a dream one day that all individuals, regardless of background, do feel
valued, supported, and empowered to contribute their best work.

[39:30–40:00]
Was a victim of gaslighting, I was almost convinced by the new administration that I didn't know
what I was doing, despite my extensive work experience. The day before I resigned, my blood pressure
was one sixty over ninety-eight, and one of my eyes was blood shot.",0
20,0:40:00,0:42:00,"[40:00–40:30]
I have a dream that Mike Miles will get a heart and forgo his hard hearted legacy. I have a dream
that the Board of Managers will stand up for themselves and not be afraid to stand up to Mike Miles
and do what's right. I have a dream that scholars will get back to loving education. I have a dream
that real fine arts will return. I have a dream that teachers will be given the respect that they
deserve. I have a dream that Trump's 2025 project at Cullen go away. I have a dream that scholars be
given the respect and not have to take tone.

[40:30–41:00]
Have to take cones to the bathroom. I have a dream that F. Mike Miles will not be able to spend
almost $1 billion willy-nilly and custodians' salaries will cut. I have a dream that one day we will
be able to say, free at last, free at last. Thank God Almighty, we're free at last from you all. And
F. Mike Miles, the tyrant, and his minions. And then we will probably sing. Respect us by leaving us
alone. Get out of AJZ, go back.

[41:00–41:30]
where you belong, because y'all don't really care about us. Thank you, ma'am. Thank you, ma'am. Our
next speaker is Min Don Tran. Speaker number 17, Min Don Tran. Hi, speaking on item number two,
community engagement. I have a dream that the District Advisory Committee will be elected community
members.

[41:30–42:00]
Members, that HIIC will truly listen to all families, including the underprivileged ones whose
parents don't go on walks with board members, that the district will have true consultation with the
unions of teachers that teach your students, that teachers will have 450 minutes of planning time
every two weeks, as dictated by state law, time that is at the teachers' discretion to create
lessons, grade work, collaborate with colleagues, and conference with families. That teachers will
be valued and trusted as experts who earned a degree and hold professional licenses, and that
because of their expertise, teachers will once again have autonomy to make",0
21,0:42:00,0:44:00,"[42:30–43:00]
lessons that are appropriate for their students and have autonomy to adjust the pacing of lessons to
differentiate for diverse learners with varying skill sets, primary languages, and educational
backgrounds. Lastly, I have a dream that HISD will be governed by an elected board whose members
have a background in public education. Thank you. Our next speaker is Jasmine Turner. Good evening.
My name is Jasmine Turner, and I am the Social Action Chair for the Houston Metropolitan Alumni
Chapter of Delta Sigma Theatre Sorority Incorporated.

[43:00–43:30]
Incorporated an international public service organization. Our service area includes the Houston
Independent School District. As we gather here today, I urge you to address the critical issue of
ensuring that all teachers in our district are fully certified. Teacher certification is vital for
maintaining high educational standards and providing our students with the quality education they
deserve. I respectfully request that the board explore avenues to support and facilitate the
certification process for all educators, including professional development and opportunities for
mentorship.

[43:30–44:00]
By investing in our teachers, we ultimately invest in our students' success. Furthermore, it is
important to acknowledge the previous instances of fit of fiscal mismanagement that have impacted
our district. Transparency, accountability are essential as we move forward. I urge the board to
commit stronger financial oversight to prevent further mismanagement. Thank you for your time. Thank
you. Our next speaker is Christy Brewster, Speaker 19.",0
22,0:44:00,0:46:00,"[44:00–44:30]
I'm speaking of item two, community engagement. Community engagement, for real, or is it just the
chosen community that you all engage in? The private invitations to the so-called PTOs that you want
to talk to, the pro mile organizations uh that you may want to speak with, or you just engage and to
engage with yourselves and just checking the box. C B O M, your right now, is killing your later on.

[44:30–45:00]
You not doing anything. You rubber stamping everything he wants. You all had the nerve to even give
him a bonus. And you agree to every termination he brings up. So forget the later on. No political
careers. Forget that. No board appointments. Forget that. And any land that you may steal from us,
you won't get any kind of real estate advancement. Forget that. Thank you for all that you're doing,
because you're helping us. See, we the community, we're still walking and talking. I have a drink.
We're gonna get our local control back.

[45:00–45:30]
Thank you. Our next speaker is Jessica Dugan. I find it so funny that you wanted us to give you $4.4
billion of tax dollars when you can't even account for 870 million bucks. This superintendent is
constantly having to defend himself on how he's not breaking the law. And you, the board,

[45:30–46:00]
was supposed to approve this and rubber stamp everything, and it's even more suspicious that you
haven't. The community message has been clear. Fire Mike Miles, who continues to fleece our
community, and then only then and only then will we work with you to do right by our kids. And what
since I have 30 seconds left, I'll talk about special ed. I've got a kid that's supposed to start
next year. The special ed procedures are even harder than ever. And the only reason I missed last
month is because my",0
23,0:46:00,0:48:00,"[46:00–46:30]
kid got kicked off of United Healthcare because there's no place in Houston that United Healthcare
will cover to send him to therapy. It's been in therapy for two years. And now Mike Miles has gotten
all the teachers to be on United Healthcare. Thank you, ma'am. And I don't think who are against
this take didn't care about this takeover. Thank you, ma'am. Ma'am, your time is up. Ma'am, thank
you. Our next speaker is Sarah Terrell. Yes, ma'am.

[47:00–47:30]
You are being told to sweep potential fraud under the rug. This was circumventing policy. This was
not skipping a step. Emphasizing budget compliance, Miles insists that you have no responsibility
for protecting us from waste and fraud. He tells you to reward his failure with even less oversight,
and you know this is wrong. A systemic 16 month error in cash disbursements is likely a material
weakness.

[47:30–48:00]
Weakness. It reveals a serious weakness in the control environment. If the tone at the top is that
compliance with financial controls is not important, the entity is open to fraud. This is how you
get a control failure that lasts 16 months. This is how you get Enron. Groupthink sets in and people
lose their critical ethical perspective. Miles subdues you with a limited audit that Mrs. Elizondo
refers to as it did come back. It's not a refusal.",0
24,0:48:00,0:50:00,"[48:00–48:30]
Refuse to clean up his mess, investigate this thoroughly, and refuse policy change. Thank you. Our
next speaker is Ruth Hoffman Lack. This is two likely material weaknesses. There we go. This is two
likely material weaknesses in cash disbursements and in control environment. This is a fatal
combination for fraud. On November 7th, Weaver and Tidwell signed a clean audit opinion for HISD. No
material weaknesses or significant deficiencies.

[48:30–49:00]
Yet just one month later, admin had found this longstanding error, quantified it, and prepared 140
pages of retroactive approvals for our December consent agenda. Who knew about this and when did
they know it? Your auditors should have been informed and given a chance to modify their opinion.
How transparent was HISD with its auditors? Was this hidden from them? Was Terry and Miles, would
Terry and Miles attest to their representation letters to the auditors? When did they know about
this? Enron also failed because the auditors were actively.

[49:00–49:30]
overlooking accounting irregularities. How can public have confidence in your audits when they miss
a problem this serious? Fire the liar. Thank you. Our next speaker is Brianna Mohan. I'm speaking
this evening in honor of my late father-in-law, Ambikai Pakar Arunasalam, who was an excellent
internal auditor.

[49:30–50:00]
and an excellent union organizer in Malaysia. The audit committee has not met since November 5th. Is
a systemic failure in purchasing the process that is subject to the highest risk of theft and fraud
not important enough for a meeting? Who authorized the audit that came out in perfect shape? It
could not have been the audit committee. Where is this audit? When will your great transparency
allow us to read it? Why did internal auditors not find",0
25,0:50:00,0:52:00,"[50:00–50:30]
this failure. Does this change? Does this change the 2025 audit plan? There must be a closer look at
purchasing and disbursement. Yet Miles' solution is for you to sweep it all away, sign off on
contracts retroactively, and increase. Thank you, ma'am. Our next speaker is Ruth Kravitz.

[51:00–51:30]
Good evening. I appreciate the work you do, and I look forward to changes. How did the $870 million
in unapproved spending go unchecked for 16 months? Why did this come to light publicly after the
bond election and right after HISD got its clean audit opinion? Where were the internal controls? As
Maya Angelos said, when someone shows you who they are, believe them the first time. If this
system's failure had happened under the HISD elected board,

[51:30–52:00]
The TEA would have imposed serious consequences, but now TEA is silent. This error persisted so long
that it's clear that there were no backup controls. As required by your own LSG governance
framework, control controls should have detected this. You should share publicly how and why
everything has failed.",0
26,0:52:00,0:54:00,"[52:00–52:30]
Speaker is Karina Casada. Yes, ma'am. It's on? I think so. Rick Compo says that procurement is
complicated and mistakes were made. He looked into people's eyes and there was no malintent. All's
well. His tone from the top minimizes compliance with controls and policy and tolerates incompetence
in procurement. Mr. Compo is actually quite fraud-friendly. He wouldn't

[52:30–53:00]
He would never be so merciful in his own company. The responsible employees would be fired. But
Campo is happy to pave over Miles's and Terry's failures with retroactive approval of $870 million
in contracts with no discussion, an astronomical amount, 40% of our annual budget. Our money is not
worth protecting. Mr. Martinez says it's not a board issue. He appears to believe the board has no
fiduciary responsibility. The massive failure is an operational challenge that Miles will fix.
Protecting our tax dollars is not.

[53:00–53:30]
his concern. Our board operates under the old motto, good enough for government work. Our next
speaker is Tracy Riley. Miss Riley? I think we I'm 27. She's 26. Oh, I'm sorry. You're right. Ms.
Candida. Okay. This is a procurement failure where the risk of fraud is highest. This deliberate
mistake persisted unchecked for 16 months. Miles' very first ask was to increase the unsupervised.

[53:30–54:00]
Increased the unsupervised spending authority from 100,000 to 2 million. He wanted the monthly
agenda not to show what he was doing. Miles hid $870 million in contracts and also hid the fact that
he was not getting them internally vetted or bid. Cooperatives were a useful loophole in the
approval process. More than a mistake, this was circumvention of controls. Now he insists you make
the loophole permanent with yet another policy change. This situation is ripe for contract steering.
Take outreach strategies. The 1.6 million consultant used for the bond election.",0
27,0:54:00,0:56:00,"[54:00–54:30]
election. It seems unlikely you'd choose that from a cooperative stock list. Could HISC have placed
that vendor on the list itself then chosen it? That would have been that would be contract steering
and that is fraud by Mike Miles. Our next speaker is Amanda Parrish. I'm sorry, Tracy Riley. Thank
you. Good evening. A review is not an audit. Everyone up here professionally knows that. A real
audit would explain what went

[54:30–55:00]
wrong, how this was discovered, and why it went undetected for 16 months. An audit should include
the review of each of the $870 million contracts, a sample of other purchases to ensure admin
identified all of them, and in what circumstances is it justified to purchase through co ops rather
than an internal HISD vendor betting, bidding, and approval? Or a review of each agreement, review
the cooperative's procedure for vetting vendors, determine whether a member of the co op can request
to ad vendors and then choose them. What is in the best interest of the public? You say that it's

[55:30–56:00]
not your board work, but your governance gives you points. How can we spend the children's money
that doesn't go to them and have no review and call it not board work? Aspects of good governance
transparency, accountability, participation, rule of law, responsiveness, equity. Our next speaker
is Louis DeCôte. I'm sorry, Amanda Parrish.",0
28,0:56:00,0:58:00,"[56:00–56:30]
Amanda Parish. Yes, ma'am. That's me. Okay. Hi, Amanda Parish, a parent of HISD student and taxpayer
and community member. What to talk about today is really hard to select. I am project management
professional, so I really, really tried to gravitate. I really tried, was definitely gravitating
towards all these audit and the concerns, and the fact that it's on the consent agenda is alarming.
That should be pulled from the consent agenda. Number 14, on these millions and millions and
millions of dollars.

[56:30–57:00]
please pull it from the consent agenda. The other point I want to talk about is also on the consent
agenda number eight and how it relates to item number six in regards to programs and magnets. When I
read the community report and the feelings from there, I as a community member do not relate to
those commentaries. What I see is multiple times programs being cut without real engagement. There
needs to be time put into number two communities where there's actually data reviewed in pot.

[57:00–57:30]
Thank you. Thank you. Our next speaker is Lewis Dickhote. And if our our next speakers from 29 to 39
don't mind coming forward, that would be helpful. Thank you.

[57:30–58:00]
Of $870 million in spending during the last 16 months. For the last 16 years, I have advised
corporate boards on a wide range of corporate transactions and governance matters. To hear
Superintendent Miles characterize a failure of this magnitude as an administrative oversight and
deflect blame to his subordinates for his own gross incompetence was profoundly disturbing. Since
this body is either unable or unwilling to hold Superintendent Miles to account, I'm here to remind
you that this board's responsibility for oversight of",0
29,0:58:00,1:00:00,"[58:00–58:30]
the district's finances is kindergrade corporate governance. What happened here was not only a
breach of trust, it was a breach of your duty to oversee the superintendent. And while I'm on the
top of accountability, this is normally the part of the speech where I ask my fellow voters when did
we stop electing leaders of integrity? But then I'm reminded none of you were elected. Thank you,
sir. Our next speaker is Laura DeCot. Yes.

[58:30–59:00]
Laura Yes. Yes, ma'am. Are you Laura? Yes, ma'am. My name is Laura, and I'm a parent of three HISD
students, two GT, one with an IP, and one with a 504 plan. My youngest two attend Warden, and my
oldest is in Lamar's IB program. Uh and I'm sorry, Lamar. I also hold a master's in curriculum and
instruction. I've watched with heartbreak as current leadership imposed rigid changes on our
schools. Returce confirms these policies fail to meet the diverse needs of students and
disproportionately harm those with disabilities. English learners

[59:30–01:00:00]
and gifted students. My children have lost incredible teachers, nurses, and friends, people who made
learning joyful. The recent near billion dollar error highlights a troubling lack of transparency
and accountability. Instead of being treated as partners in our children's education, we are
dictated to by those we did not elect. We need leaders who value transparency, foster trust, and
collaborate with parents, not work against us for the success of our children. Thank you. Thank you.",0
