chunk_id,window_start,window_end,text,binary_hit
29,0:58:00,1:00:00,"[58:00–58:30]
High school to accomplish and provide a 94-foot court with increased seating capacity. So we'll show
you some more exhibits on that. I want everyone to realize the three gyms at Memorial High School
are labeled on this exhibit. Gymnasium one is in the heart of the campus, and we have labeled as the
competition gym. Two is kind of to the southeast, what we have called the practice gym, and then gym
three to the kind of bottom left hand corner. When we looked at the three gyms at Memorial, we only
had one 94-foot court and two 84-foot courts, so we were asked to explore.

[58:30–59:00]
potentially expanding those. When we looked at all three courts, court number one, which we had
labeled competition, was in the middle of the campus, and we have labeled as a severe impact to go
in and replace that in its current location. It would be the most major disruption out of the three
because it's in the middle of the building, and because it is surrounded by the support spaces,
which we are not able to get to a replacement of a gym without severely impacting. So the locker
rooms, the coach's office, and the surrounding spaces would all be disrupted.

[59:30–01:00:00]
you know, along with a gymnasium that would have to come down for potentially two years to rebuild.
It's right in the middle. There would be no loss of parking, but the core building infrastructure
would also be significantly impacted as the utilities, the power, the air conditioning, everything
is central and therefore further disrupted than the other two locations. The practice gym, which was
kind of to the lower right, is is sandwiched in between a gymnasium and the parent drop-off.",0
30,1:00:00,1:02:00,"[01:00:00–01:00:30]
So that had a moderate impact because to make that gym bigger and create a larger footprint, we
would have to displace the dance uh room and go into that parking lot where the parent drop-off is.
That is not able to get much smaller. Um, it provides fire access, emergency access to the adjacent
building, um, and there's limited parking in the middle already, and so that really had the moderate
impact. Existing auxiliary gym three, which was in the bottom left-hand corner, um, had the minimal
impact out of the three. Uh

[01:00:30–01:01:00]
It is accessible on site for construction. There's some space and real estate to expand it to be
that larger size. And it was more minimally disruptive to the overall flow of the campus because of
its location than the other two. So what we have shown on the updated exhibit for exterior is that
keynote number seven, which would be a 20,000 square foot competition gym seating 1,400 people. Two
sided bleachers, and we'll show you a plan in that. But you can see on there to the right of Keynote
7 and the red box.

[01:01:00–01:01:30]
is the practice gym that would to expand would go into the parking lot and the parent drop off, and
then to the north, the competition gym that's central to the campus. So we've provided a conceptual
layout. You guys asked us what would a competition gym include. So this is the 20,000 square foot
laid out programmatically. You'll go through a detailed design process to lay this out and locate it
in its precise location later. But this is what it would include and what it would result in in
providing a larger space. So you can see a new defined entry to the left.

[01:01:30–01:02:00]
adjacent to the existing parking lot, the support spaces, keynotes two and three, which are
concession and restrooms, the 94-foot competition court in the middle, and then the 1400-seat
bleachers, which are split, retractable systems on both sides, and then of course the six uh
basketball goals that would would be in there. This is this is intended to show you guys what would
be added. Are there any questions on Memorial before I move on? Okay, no major.",0
31,1:02:00,1:04:00,"[01:02:00–01:02:30]
changes to Memorial High School on the exterior. Again, the conceptual plan, West Campus, no major
changes. East campus, no major changes. You will notice that that turf practice field, keynote six,
which is a field and a half, is colored. That again has been rolled into scenario three. So the
updated costs at Memorial High School include the interior, the exterior, and then the competition
gym is the additional consideration. If you add that in, it brings the total to 69 million for
Memorial High School.

[01:02:30–01:03:00]
Moving to Northbrook, uh no new limitations and challenges to note, the aerial to orient everyone.
On the interior, we wanted to clarify that there is a new bleacher system in meeting with athletics
going into the gymnasium that did not have bleachers currently, so that had been included, and we
clarified. The three gymnasium locations at Northbrook, the analysis showing two 94-foot courts and
the third 84-foot, the exterior at Northbrook.

[01:03:00–01:03:30]
High School will include a new band tower. We have highlighted and added that, which benefits fine
arts and the use of the band. Would um so 1400 leacher capacity at Memorial with redoing that gem,
but then at Northbrook um they have one that seats 608 and 312. Would or the other 94 foot one only
seats 312? Is that right? Yes, that's those are the capacities. I mean, all of the gems are
currently.

[01:03:30–01:04:00]
All of the gyms are currently functioning. They're pretty limited in being being able to go in and
add a lot more. We studied existing and the court size more than anything. So we can always go back
and look at any gymnasium or any school if we need to increase those capacities. When we do replace
bleacher systems, we of course will provide the maximum amount, you know, efficiently laid out on
both sides, meeting the district standard and the space itself. That's you know that's what I would
say at this point. Has Northwork weighed in on that? I mean, do they need I'm just curious if they
need more seating while we're there?",0
32,1:04:00,1:06:00,"[01:04:30–01:05:00]
Just can compare to the other high schools, it's just or some of the other ones. I don't know. So in
the last bond, um Northbrook and Stratford when when they added the thr third gym, at Northbrook and
Stratford they added a larger gym. So at Northbrook and Stratford their their their competition gym
became their second gym. And at Springwoods and Memorial their gyms were they the the two gyms that
were added there

[01:05:00–01:05:30]
were smaller gyms. So uh again, um, you know, I I would I was like for example, I was at Springwoods
High School last night and and watched them play. It was it's tight. I mean it's it's a tighter
tight gym. But I would say, like again, at Northbrook and Springwoods, and they're what they're
calling here their auxiliary gyms, those two gyms which are right now they have tartan floors, um,
they don't have any bleachers. So that's why again I said, Well, we for sure need to have bleachers
in that in that gym, because that will then like at Northbrook, then that would become a bigger

[01:05:30–01:06:00]
gym than the gym that has existing bleachers. And that Springwoods, that third gym, is that you know
they played JV there last night. You know, there are all kinds of people that are standing in there.
So again, there's no doubt that I would say that probably uh all of our gyms are smaller than some
of our surrounding neighbors. But for sure, I think where where we can add bleachers uh in in those
two gyms, and probably we we it would be something that we need to look at, if not now, just be to
be aware of it that they probably need to be larger for.",0
33,1:06:00,1:08:00,"[01:06:00–01:06:30]
the future. Well we might as well do it now. I mean there's no point in being aware of it. So I mean
I think we need to make sure that they're usable in a practical way if we're we're doing all this
now. Okay. No. I mean even the you know the main gym obviously is the one that seats the most people
and that's used by the varsity sports but the I guess the other two gyms I mean they do they won't
draw as many people but they will you know JV freshman type sports play in there and so they
definitely need if that's how the schools use them.

[01:06:30–01:07:00]
they definitely need seating. Yeah, yeah. And same for Springwoods, because they don't have one that
seats a thousand. I don't know. I'm just we need that's why I want to hear from the schools and do I
hear you say there's room for additional seating? I have to go back and look at each gym. I think
that there's the ability to add some in each, but I'll I'll need to more closely study each
competition gym, the system that's there, and then you know the efficiency of going back with them.
If there's depth, you know, there's a safety zone around the sidelines and the baseline, and we
can't encroach in that um but close to the playing playing surface, if you know what I'm saying.

[01:07:00–01:07:30]
playing surface if you know what I mean. So some there may be a limitation in being able to bring it
closer to add rows, you know, or we may be able to. So we'll have to study it. Yeah, you I mean you
would think there is the same square square footage as Stratford. I'm trying to think of
Northbrook'cause my son just played there last weekend, but what do you hear about? The seating. I
mean it's the same the gym itself is the same square footage as Stratford's right now. Yeah. So you
would think add more seating.

[01:07:30–01:08:00]
It's possible. Reconfiguring the whole gym. Yes. Yeah, yeah, based on the square footage of comp gym
one across the board from ten to twelve thousand. Yeah, we'll look at that. There may be space to
expand and add a couple of rows and what that would result in capacities. But I I think it would it
kind of brings up a n a good point though, and that is I I think with the time that we have left
prior to calling for a bond. I mean I think that's feedback that would be great coming from the
principal. Like how how do you intend to use this gym?",0
34,1:08:00,1:10:00,"[01:08:30–01:09:00]
aside from uh the obvious basketball games, but I mean, you know, pep rallies or community meeting,
whatever they might use it for, what what sort of seating do we need because I I don't think these
things will be touched again for another forty or fifty years. Well that's right. Yeah. Anyway. So I
would I I would look into that, but but I guess the broader point is is I appreciate you're going
through campus by campus and kind of what the updates are, but I think it's it's extremely important
that we get some feedback from the principals and the athletic directors at each campus just to make
sure that what we are doing makes sense

[01:09:00–01:09:30]
for what they want and what they really need. That was that was actually a question that I had is
how much just because we are at a limited timeline because of this project, how much feedback have
our principals, assistant, you know, our athletic directors and our coaches been able to provide
when we're sp we're now asking to potentially spend this much money. Are y'all are they comfortable
with where we're going, you know, and have they provided enough input to move forward? Yeah, I I
think you know uh I I would I I I certainly feel I think it would be very valuable to

[01:09:30–01:10:00]
for even like I I have been talking to them and you know again I know I know that they're watching
uh because there have been text I've gotten a couple texts, but I think things have been moving so
quickly. I think it's very important since they also are going to be visiting with their
communities, their communities are gonna be asked asking them questions just to make sure. I'd
certainly be happy to sit in as well. But again, I think just so that we could go through and sort
of have that inventory of you know items that will be in there because I know we've kind of talked
about I've even asked, like, hey, is this in there or this is in there? And I just think for them,
for the",0
35,1:10:00,1:12:00,"[01:10:00–01:10:30]
having that certitude and also being sure that again I think it's important that those are the that
are closest to the action are involved in the decision making. Yep thank you thank you okay back to
Northbrook High School no major changes to the to the layout Northbrook's numbers um do not have
significant changes just the minor updates we mentioned so 56 million interior and exterior
springwoods high school no noted

[01:10:30–01:11:00]
changes to limitations and challenges. Site aerial interior, again a new bleacher system in the gym
that did not have any. We wanted to further clarify based on a question last time the
reconfiguration, renovation, and expansion of the weight room at Springwoods High School is included
in these numbers in scenario three so that it can be increased in size to better meet the needs of
athletics. The three locations of the gymnasiums at Springwoods, the breakdown of the square footage
and analysis.

[01:11:00–01:11:30]
Analysis. And no major change to this diagram, but I will note again it has been rolled in from
scenario two to scenario three in the interior upgrades that there would be added square footage for
restrooms and dressing rooms at the location where the red arrow is pointing. So that would better
serve gymnasium one and gymnasium two that do not have those spaces easily accessible and cause
challenges for the campus in athletics.

[01:11:30–01:12:00]
No major changes. And the conceptual plan, again, no major changes. I will address there was a
question brought up what if the natatorium was not rebuilt, where it is shown in a dashed line next
to keynote 13 in the lower left. If softball, if that natatorium building remained, we would
obviously not be able to relocate softball. So at that time, we would take a step back, we would
study the plan of Springwoods High School, we would look at each element, each component, each field
event, and determine its ideal location.",0
36,1:12:00,1:14:00,"[01:12:00–01:12:30]
orientation, and adjacency so that we're making the best decisions moving forward. That could
include looking at the above ground detention and keynotes 12, the parking lots as we've identified
them with being replaced, and the other components because obviously we would not be able to
relocate softball and it would need to remain to the north. So would the the money put aside for
rebuilding the softball?

[01:13:00–01:13:30]
field in a new location, be able to cover doing what you need to do if it doesn't move. Yes. The
softball field and the softball complex and all of those components would still be included so that
we could replace it. They would still get a new synthetic field, they would still get new buildings,
dugouts, athletic netting, that would still be covered. Right, but all that would okay. Yeah. Within
the Springwoods High School project, yes. Yeah. Stratford High School, no noted changes to
limitations and challenges.

[01:13:30–01:14:00]
the site aerial interior, we have added the new bleacher system into the gym that does not currently
have bleachers. Stratford gym locations, one, two, and three. Stratford analysis. And Stratford
exterior. So we have a few updates here. The highlighted items again we reconfigured the softball
field to include new synthetic turf, renovated buildings, and a new press box that is regardless of
location, it will be included. We've provided a new band tower in the backup.",0
37,1:14:00,1:16:00,"[01:14:00–01:14:30]
We have consideration to reconfigure two natural grass fields to accommodate one synthetic turf
field and the possible relocation of that softball field. We're going to show you the two options.
And then we did include and roll in the synthetic turf playing field lifecycle replacement to
clarify that that included all of the synthetic turf. So Stratford looking at baseball, no major
changes. Stratford softball, this is option A. So option A has the new softball field being built
with synthetic turf, new buildings.

[01:14:30–01:15:00]
and everything of that complex beside Don Coleman where it currently exists. And then we were asked
last time to investigate could that softball field be relocated down across Fern and down onto the
main campus, at which point we looked at this concept and this layout. So if you relocate softball
where it's shown here next to the high school stadium, Stratford's fortunate they have the two
practice, grass practice sod uh fields. One of those would be eliminated and you would be able to
fit one.

[01:15:00–01:15:30]
Um one competition turf field as it's shown in a different orientation, so left right. Um so it
would fit. Um it just would take away one of those two practice fields. And has that been discussed
with the athletic director at that at Stratford? Would mean to lose a practice field. We met with
Paige and her department to allow her to go back and communicate the option being discussed. Um I
can't speak further myself personally to especially if we uh please so I I can jump in real quick.
Sorry. So

[01:15:30–01:16:00]
I had some of the same questions, you know, uh about sequencing and what happens with some of these
scenarios. So I took it upon myself to just go meet with Rankin and uh Barnes. And we went out there
uh I guess at 3 3 30 just to see how that was playing out. That would be a that would be a big hit,
right? Losing that second practice field. Um there's some things I just wasn't aware of. Um because
I I think initially I was going, okay, be maybe it'd be great to move that. I think I even asked you
at one meeting, Paige, does it does this make sense? Um I guess given the numbers and how we use
those fields, uh they",0
38,1:16:00,1:18:00,"[01:16:00–01:16:30]
really migrated more towards hey, it'd be great if we left it over there, or if it did come to main
campus, go to a different spot, right? Uh but when I start looking at different spots, it it starts
getting really tight, right? So um yeah, kind of getting that intel. Uh I think what was also
interesting is once you really start getting out there, and I know Chris has done a lot of walking
around. I'm just curious, what's in that water tower? Is that empty? It's not empty. Do we use it
for something? Like w what's in there?

[01:17:00–01:17:30]
Water But for what? Yeah, backup fire uh fire suppression system. Does every school have a water
tower for backup fire suppression? Okay, so i is that a is that a need or w I guess I'm going
somewhere with this, right? I mean, because we were talking about recruiting and you know what are
the things that schools really need to be looking at and you know another field house came up,
right? So that is actually something, John, that we've been asked about and we have just not really
taken the time to investigate whether that is still required and

[01:17:30–01:18:00]
And needs to remain. I do want to point out that in terms of Stratford, very much like our
conversation with the options for the natatorium that we talked about in scenario two. So we had the
three options that were shown, and then the conversation came up about natatorium. I grinned at uh
board president because that was something that we had actually started doing. So the conversation
about Stratford and looking really for safety and for efficiency, being able",0
39,1:18:00,1:20:00,"[01:18:00–01:18:30]
to bring the softball field over to the main campus. This is one option for consideration. We
understand that there are two sod, natural sod, natural grass fields there now. We've outlined what
this option would do, but we also believe that with some configuration, the softball field could be
placed just north of the baseball field. But there would be some effect in terms of some of the
driveways and the above ground detention that is.

[01:18:30–01:19:00]
currently there but PBK has started to rough out where that how that would look and we believe that
ultimately if the desire was to bring would be to bring the softball field over to the main campus
and still keep the two fields, our recommendation would still be that one of the fields goes to
turf, synthetic turf, that we could look at bringing the uh softball field and placing north of

[01:19:00–01:19:30]
Of the existing baseball field. Yeah, so where the where the putting green is and where that
discosteel is, right? And so so we looked at that, and I guess what was talked about there is if we
do that, then we're already losing. Well, I guess our parking is precious and tight right now. To
make that happen, we'd probably have to lose some more spaces. But do you think I think we don't
have to, or with the scenarios that we are looking at, and again, we're we're just now working
through these designs. As you would move and place a softball field north of

[01:19:30–01:20:00]
the baseball, and then start adjusting some of your entries into the parking and then enclose your
above ground detention to allow for underground detention, which would allow for parking to occur.
We believe that we would actually add a few more spaces so you wouldn't be reducing the total amount
of parking spaces. I also just want to say I know you guys have done a lot of work. I mean, I I've
been involved with some big projects, I know how much work this is done.",0
40,1:20:00,1:22:00,"[01:20:00–01:20:30]
I mean what we've asked of you guys is is quite a bit. So I just wanted to say thank you before the
night ended. So appreciate it. Thank you. I I personally think that would be a great idea if you
could move it over there. I mean,'cause when you look at the newer like sci-fire schools and the way
they've got it laid out, and it's only been on occasion, but we've had some playoff baseball games
while there's a softball game going on, and I've always thought, you know, how neat would it be if
both games were going on at the same time?'Cause right now I think at every campus they're on
opposite ends. So they may both be going on, but you have no idea what's going on. Uh

[01:20:30–01:21:00]
Going on. So that would actually be pretty cool. No, I like that idea. And then so you the things
that are there now to the north of that field would be easily, you could put those somewhere else.
You don't need as much space because it's a lot of green. Yeah. We'll use the term easily loosely,
but just don't put it so yes, we believe that it could be refigured. And just I guess, John, I know
you talked about your meeting with Ray Morse and um Coach Ray.

[01:21:30–01:22:00]
Coach Rankin, but they were they did not want to move the softball field, correct? So that that
Stratford did weigh in on that decision and and they did not want to do that. Right. Which also I
guess included turfing one additional field and they didn't want to do that. Well, so I think
they're okay with turfing one additional field. The concerns they have with that is uh I've heard
that those fields can actually get pretty hot, and you know it gets weird.",0
41,1:22:00,1:24:00,"[01:22:00–01:22:30]
with the temperature with this wet bulb thing, and they're actually concerned of losing days. So I w
I was actually concerned about the same thing at Memorial,'cause Memorial has less space, but
they're gonna turf the one grass field that's there. And I was curious if it would be better to be
half and half, so you at least had one half that was temperature controlled than the other maybe
that isn't, but the coaches overwhelmingly said turf. So I think it's that's something that like is
a campus by campus decision, I think. I mean, if that's what they want, that's what they should get.
But they didn't want the softball field in replace of that practice field.

[01:22:30–01:23:00]
Do they know the scenario we just discussed? Yes. Yeah, I think you either move it, move it directly
behind the baseball field or don't move it at all. Yeah, but they I just wanted to say they they
heard the scenario weighed in and said no, we don't want to move the software field, and no, we
don't want to have that additional turf practice field was my understanding. Right. But what we
should work on, so I'm clear, what we should work on in development of the next layout would be the
alternate location, relocating softball north of baseball and what the practice fields would look
like adjacent, correct?

[01:23:00–01:23:30]
Okay. Stratford High School includes the interior, exterior, and then you see the additional the
additional consideration of the practice field 4.3 million. So that 49.7 um will bring back updated
options next time on that location for softball and its cost impact on the total project. Reggie
Grove Stadium. I have one question. This is kind of detailed, but on the when we go talk about
Springwoods and the

[01:23:30–01:24:00]
current natatorium and the scenarios of we've we've chosen, I think, to go down the road of new
natatorium or nothing, but I've also been convinced through this process that the old natatorium is
not the answer. So not to get too far ahead of ourselves, but when you think about the timing of the
the softball field is supposed to move on to the old natatorium. But if the new natatorium were not
to pass, but say the campus package did, um are we of the mindset?",0
