chunk_id,window_start,window_end,text,binary_hit
61,2:02:00,2:04:00,"[02:02:00–02:02:30]
scores, obviously, based on our rubric. Do we have a similar um uh evaluation that's been done or
assessment based on the student outcomes? So the the student outcomes are tied to T tests. Okay. So
that'll show up there? Right. So that's where the student outcomes will show up. And um I know I
mean there's m there's multiple different components of that. Is that fair? Yeah, there's four or
five for the teacher. So the the the achievement is worth 35 percentage points.

[02:02:30–02:03:00]
Points, instructional call quality is 40. So that's about 70 to 75 percent of all of a teacher's
evaluation is T test evaluation is based on instruction and achievement. Okay. Um have you have
y'all dissected that at all to determine whether it's proficiency driven or otherwise? Uh no, we we
have not separated instruction from proficiency. Got it. Okay, thank you. Anything, Mr. Kempo? Mr.
Martinez? Superintendent, thank you for the information. So I'll say from a background of

[02:03:00–02:03:30]
Uh background of HR, almost 20 years. Um, recruiting is difficult uh regardless of what industry
you're in. It's very difficult. And sometimes I have learned in my experience you have to get
creative in order to hire individuals. So when we look at the medical profession, we were short of
physicians, you came up with APRNs and physician assistance. So I understand that here in this
particular need, there's gonna be a need to hire individuals who are pursuing certification. So the
one thing I would say is that when you look at the TTS scores, I think you looked at it, um I think
it is important to what we're reiterating is this idea of improvement year over year. Um I also
recognize that.

[02:03:30–02:04:00]
first year change, people will make decisions on their own. But there's a lot that we can control,
the administration can control in order to retain them as well. As we move forward in this process,
recognizing I think T test, if you if you go back to that slide, we had about 40% of the T test that
were proficient who left, so that's about eleven hundred teachers. And this is only considering June
and July, it doesn't consider the rest of the year. What are we doing differently this year to
ensure that we are retaining teachers? So I you know, retention starts with recruitment.",1
62,2:04:00,2:06:00,"[02:04:30–02:05:00]
Recruitment, number one. And so making sure that we have a rigorous recruitment process and an
employee value proposition that everybody understands. So the employee value proposition has been
outlined and talked about in different forums. And what that says is it addresses the will to stay
here. So if you if you read the employee value proposition for teachers, it outlines what our
expectations are. For example, that

[02:05:00–02:05:30]
That a teacher will be visited in their classroom regularly, that there will be spot observations.
And we understand that in the profession, that is a cause for a lack of retention for several
teachers. Like in some places, teachers don't want to be observed. And so if they know that they're
going to be observed, then they won't go to that district or they will leave that district. So
saying it up front and being very clear about what that is, I think will help our retention. But
it's the

[02:05:30–02:06:00]
But the it's the supports more than anything, I think, that helps a teacher to be retained. Teachers
uh and and salary, I mean that they go hand in hand. Uh uh, you know, what nobody's gonna get
richer, but salary makes a huge difference. And by the way, I'll say for the you know, thirteenth
time, and I'll probably say it at every board meeting, we have increased the average salary in this
district in one year's time by nine thousand dollars. So uh that's gonna help retain teachers, and
you can see it in the NES orbit that when you have ninety some",1
63,2:06:00,2:08:00,"[02:06:00–02:06:30]
90 some percent, 97%, 89%, 88% retention, that's huge. Part of that is salary. But the other part is
support. Allowing teachers to have the curriculum done for them, even in the A, B, and C schools
that defined autonomy the ones with defined autonomy four, three, and two, even in those schools,
most of them are picking that because it's the support. And in the NEOs NES orbit and in the non-NES
schools that we're providing a lot of additional supports for.

[02:06:30–02:07:00]
it teachers grow confident in their ability to teach well when you provide specific instruction and
feedback. Contrary to popular belief, in some districts, teachers, especially newer teachers, want
the guidance, they want clear expectations and clear support, instructional strategies that work. So
that's the sort of thing we're doing to help retain teachers. And I suspect we're going to retain
more teachers, a higher percentage, even

[02:07:00–02:07:30]
uh those these are good, I think we are gonna continuously improve and retain more more teachers
next year. Yeah, thank you for that. I think it is going to be important that we as a board continue
to monitor that that turnover and retention. Um because I think in any industry, right, if if we
want to achieve our goals, it's important to retain um our most effective teachers. Uh because it's
gonna be more difficult to obtain our goals if we don't do that. Thank you. Yes sir and one one
other thing if I might add to the to the answer having teacher apprentices about six hundred teacher
apprentices and having them stay

[02:07:30–02:08:00]
I mean them stay, work on their certification while their teacher premises. It's an internal
pipeline. That's gonna be huge for the success of our kids also. Ms. Mendoza. Yes, I uh thank you
for that and for the the information. It's great to have it in front of us. And you just your last
statement there was where I was going. So I'm all about continuing education. One of my questions is
always how are we or are we keeping track of those that came in without a certification and to make
sure that they're on that path, the true path to certification? But even more uh you know.",1
64,2:08:00,2:10:00,"[02:08:30–02:09:00]
going a little bit further are we also then encouraging them to do more right to continue their
education outside of the certification because I think that helps with the vice principals and the
principals and then um area superintendents and all so do we have anything yet or built in to help
them continue their education which I think at the end of the day helps our students as well yes so
um first first of all yes we are tracking the teacher certi uh certification and the the uh teachers
accomplishments

[02:09:00–02:09:30]
accomplishment of that. We have the best growth, especially for teachers who are not certified or
working towards certification, is on-the-job coaching. It's good instructional practices, it's
professional development, it's PLCs, the professional learning community, it's good planning time,
work, it's demonstration, demonstration days, demo days we call it, and things like that. On top of
that, we will also we also have principals working closely

[02:09:30–02:10:00]
and providing mentor teachers to teachers who are struggling or who are brand new. We have for a
little bit more experienced teachers, the teacher leadership uh academy. Uh I don't I can't remember
how many teachers went through that last year. 300 teachers will be more this year that go through
the teacher leadership academy where they learn even more how to be even a distinguished teacher or
move into administration. Thank you. Mr. Ramon, I would just uh concur with some of the points.",0
65,2:10:00,2:12:00,"[02:10:00–02:10:30]
Concurred with some of the points earlier around um kind of the the the aging of our population of
teachers, right? So thinking about those veterans and making sure that um we can see some of the
data related to veterans as well. Um it's a little difficult for me to tease out um whether
experience and and the level of proficiency, especially non NES, is also related to years of
service, things like that. Yes, and that's uh board member Flowers asked similar question. We'll run
that data for

[02:10:30–02:11:00]
you. We'll we'll look at proficiency levels here and the years of experience and do a scatter plot
if I have my way, and if not, we'll do graphs like this to show the correlation between years of
experience and um proficiency levels. It there um I I didn't uh answer or didn't comment uh board
member flowers. You correctly pointed out there is some disguise that the data is disguised a little
bit when you look at the um this teachers working towards certification versus certain.

[02:11:00–02:11:30]
Versus certified teachers because of that level of experience. If it is true that the teachers
working towards certification are less experienced, they're in the first or second year, then the
research is pretty clear that the teachers in their first three years are less likely to be
proficient than teachers past that. So that there's a there's some other effects going on there
besides certification.

[02:11:30–02:12:00]
scatter plots then can you do one on student outcomes versus proficiency and t tests yes we can
thank you okay miss lender did you have any questions thank you Kristen did you got that it's gonna
be there's a lot of matrix there that you have to run so you don't have to do it now unless you've
got it. Yeah we'll do the scatter plot for you okay great thank you you might thank you okay go
ahead thank you um and uh one thing I I I know I said to",1
66,2:12:00,2:14:00,"[02:12:00–02:12:30]
I I I know I sent a ton of questions. One of them uh most of them were covered by by my colleagues,
so thank you. But one that that I wanted to touch on was to to just make sure that the understanding
was there for me and others around um teacher assessments primarily being um based on spot
observation data and student achievement data. And you referred to the percentages earlier. Yes,
ma'am. Um one thing that that as I reflect on last year, one one challenge I think was around the
spot observations being a a new thing for for our

[02:13:00–02:13:30]
um for our our teachers and so what I'd like to better understand is what are what is the district
doing what is the administration doing to help provide assurance that the data collection is trusted
that the data is reliable um and understood and um further to that what what learnings can you share
uh about you know the experience last year implementing this and um what can we expect to improve
see improved on this year yeah thanks for asking um separate

[02:13:30–02:14:00]
Um several learnings. That the first thing we did this summer, or actually in the spring, is to um
revise our spot observation so that we still have one form. You know, quality of instruction, there
are some basic things that cut across every school and every program. Student engagement is one. It
doesn't matter whether you're Montessori, project based learning, or traditional public. Um you
gotta engage kids and gotta engage all kids. And so that's that's part of things.",1
67,2:14:00,2:16:00,"[02:14:00–02:14:30]
Another thing is on the core courses on the star-tested subjects, it has to be aligned to the TEAKS.
That's everybody, because we are we are a state, uh, you know, we're in the state of Texas, and
that's a requirement for us to do. So those sorts of things are things that we we look at all over
the place. Having said that, engagement might look a little bit different in Montessori versus
project-based learning versus IB, etc. So we have uh a spot observation.

[02:14:30–02:15:00]
form with several appendices, Montessori, IB, Project Base, et cetera, where the principal and the
teacher knows okay, this is what it looks like in my school. Those appendices were developed by the
teachers who are in those various programs. So early childhood has some, has it has a different way.
Even though some of the basic things are still there, it looks different in early childhood. You
know, it's special education, career tech ed, et cetera.

[02:15:00–02:15:30]
So that's, I think, is a huge improvement. And so far we've heard from teachers and principals, that
is a huge improvement over last year. So that's one of the things we're doing. Number two, we know
that there's a need for more spot observations or feedback from for teachers who are new or who are
working towards certification. And so those principals are encouraged to do more spot observations,
and we average that in a month for the teacher. And that way they have a better chance of

[02:15:30–02:16:00]
Of of getting a higher score, but a more higher is not the right word, more supported score or score
based on more support. So that's a that's the second thing we're doing. And then the calibration of
IRTs, we learned in the second half of the year last year to narrow the number of people who could
do these IRT visits. That makes their training and their calibration easier, tighter. And so you're
gonna see IRT teams that are much stronger. And remember, IRTs are not for teachers.",0
68,2:16:00,2:18:00,"[02:16:00–02:16:30]
Teachers, it's for the school. But even even so, that calibration is there. And we do constant
principal training on the key things on the spot observations. We did it this summer. I've already
done it this year, especially with EDs also. Next Tuesday, 17th, we're revisiting many of the same
things. I'm doing the training for for the morning, and then we have other people from the
professional development department doing training so that we're all aligned and on the same page.
The calibration walks from us to

[02:17:00–02:17:30]
when we go to the schools are with principals and we talk about the instruction. I mean, we are
broken record on instruction so that we will be calibrated. And this year we're the executive
directors are trained even more every week for the first semester. Uh and so the first five weeks
have been trained every Monday by me just for 45 minutes, but every Wednesday by the professional
development department for about two hours.

[02:17:30–02:18:00]
So there's a lot of training and it's all I mean we're pretty redundant on on these things. So that
comes from all the lessons we've learned over the over the year. Thank you. Ms. Lowers? Just
briefly, the IRT team, you said it's tighter. Can you describe like which sorts of titles, like who
who would be on an IRT team? Yes, and uh maybe if uh Chief Massey can come up to to give you more
accurate data than I could give. Chief of Leadership and Chief.",0
69,2:18:00,2:20:00,"[02:18:00–02:18:30]
Leadership and strategic initiatives. Hi guys, nice to see you again. The IRT team is mostly
comprised of executive directors of schools. They just do not evaluate their own units, their own
divisions, they evaluate other divisions, but it also includes proficient two and exemplary
principals. They participate as part of this process. Um, my team that's been trained as part of
this process, and a lot of members of our curriculum uh department who also has been trained. So we
do training upon training upon training.

[02:18:30–02:19:00]
we tweak and make it better every single time we do it. And um every single one we had last year got
better and better and better. We got better and better feedback from both the IRT team, the
divisions, and the principals. So we feel pretty good about the process, but also the principals get
to select their two highest scores out of the four. So it's it's really a level of support, not so
much evaluative. Thank you, Mr. Campo. I do have uh just a quick uh question and comment. Um you
know

[02:19:00–02:19:30]
these numbers when you look at the 2600 uh what was it, 2600 and some some change, 2696 teachers
that left in June and July. I read reports of 4,000 plus and lots of different numbers being thrown
around, you know, in the media. Uh I think it would be very helpful if we could have a quarterly
retention slash um uh turnover analysis done. Uh most companies do that quarterly where you just see
where things are and you can do it by division, you can do it in this proficiency way as well, so
that we have uh

[02:19:30–02:20:00]
a good communication uh that is consistently uh communicated to folks because you hear just
tangentially about and and uh about oh gee, th everybody's leaving, right? Yet you have twenty-six
positions open before at the at the beginning of the year, right? Or twenty eight or something like
that. Right. Right? So can we get something like that and then publish it so the public can see it
every quarter? Here's how many teachers came, here's how many went let went. Per principals, same
thing. Yes, sir. We can we can do that. So uh what I'm hearing is at the end of each quarter. Yep.",1
70,2:20:00,2:22:00,"[02:20:00–02:20:30]
quarter so October 15th or whenever the the quarter ends we we give to the board um you know these
are the number of teachers who who left the district that'd be great thanks can I ask a related
question though uh when is the leveling happening because I wonder if that would be a better time to
do it yeah thanks for asking the leveling is happening right now okay so we wait till after Labor
Day because you know that sometimes kids don't don't get here uh exactly when school starts so right
now we're doing leveling especially in the NES schools now the the non NES have

[02:20:30–02:21:00]
control over the staff and they can level the way they want as long as they don't go over budget. So
um so that's also happening now as well. We will have um we will have some teachers to move to
different uh places. Got it. Okay. Any other questions, comments, concerns, things to raise? Okay,
then I guess we're on to constraint. I'm sorry, goals. Yes, ma'am. So I'm gonna shift the PowerPoint
uh to the PDF.

[02:21:30–02:22:00]
And invite I believe Kristen, are you up first? I believe you are. For goal three. Do we want to
break? Yes. Um can we just have a seven-minute break? Let's take a break. Thank you. Okay. We're on
break seven forty-one. Okay. All right. It is now seven fifty.",0
71,2:22:00,2:24:00,"[02:22:00–02:22:30]
Yes, ma'am. Oh, we are not back from our break. We'll be back from our break in a moment. Well,
wait, we're not live yet. Okay, we're now ready. Okay, so now we are going to go to acceptance of
board monitoring update, the presentation of gold.

[02:22:30–02:23:00]
The presentation of goals three and four. We're back from a break, reconvening at 7 52 p.m. We'll
now open the floor to our monitoring conversation. As a reminder, the board has already submitted
questions before this meeting. The questions are posted with the agenda materials and have been made
public. And the questions during this meeting should be of a strategic nature, meaning that we ask
questions that help us understand how the reality for our students is aligning with our vision. So
with that, it looks like Ms. Hole is ready to begin.

[02:23:00–02:23:30]
Begin. Yes, thank you for having me. So today we're gonna cover goal three as well as goal four and
constraint one. So I just flipped through those slides so you they're an agenda view of the goals
and the different uh data points that we're showing for reference. Um but I'm gonna start off with
goal three, which is the percent of students graduating TSI ready and with an industry based
certification will increase from 11% in the 21 22 graduates to 26% for the 26 27 graduates. Um

[02:23:30–02:24:00]
So, a couple things on this. Big picture for goal three we have met this goal. At 12% of our
students, that was the goal, and that's the percent that we achieved. So this goal was met.
Additionally, a couple things to note one really important thing about this goal is it really looks
at the overlap of TSI and IBCs, which really ties to our overall strategy of providing both college
and career pathway opportunities for all students. So this goal really helps support that. However,
this data and the data from the state lag a year.",1
72,2:24:00,2:26:00,"[02:24:00–02:24:30]
So we're looking at our 22 23 graduates. So this is an important thing to keep in mind whenever
we're presenting on goal three. And so what this shows is that from for this goal, we many of our
sub populations met this goal with the exception of white and Asian students. And similarly, when
looking at NES and non NES, we had differences in terms of subpopulations that.

[02:24:30–02:25:00]
met it, but overall all students were still meeting it. So this helps us stay focused on the
subpopulation data as we can continue. But again, even in the NES non-NES distinction, this was
school year 22, 23, so NES wasn't even in place at the time. So we're keeping that in mind when
we're looking at this data. We then broke out TSI separately from IBCs so that we could look at the
results in dis distinct of each other. So what this shows is that all students, and this is actually
a coincidence, all students.

[02:25:30–02:26:00]
39% of students were TSI ready, and 39% of students were obtaining their IBCs. That's a different
set of students, but it just happens that they're both 39. From a TSI perspective, though, we really
saw high percentages of white and Asian students who met the TSI criteria. And for IBCs, those
populations of students were lower for IBCs. And some of you may imply that we need to increase
exposure for our career courses for those populations of Asian and white students.",1
73,2:26:00,2:28:00,"[02:26:00–02:26:30]
This looks at similarly TSI separately from IBCs, but it looks at it over time. So we were on the
previous slide, we were just looking at it for one single year. This looks at it over time, and what
we see here is that over time for TSI readiness, the district has been growing in both reading,
math, and then students who meet both criteria. However, we've been doing better in reading than we
have in math over time. Similarly, for IBCs, it shows a district trend has been increasing. We've
been increasing in the

[02:26:30–02:27:00]
percentage of our students who obtain their IBC. However, this would include IBCs that are being
sunsetted. So over time, as a part of TEA accountability, TEA will sunset IBCs that they deem not as
rigorous towards career pathways. And so we'll have to keep that in mind as we look at this data in
future years. We won't be able to count IBCs that are sunsetted going forward. Now we move to goal
3.1. It's very related to goal three, but it focuses on the percent of 11th graders.

[02:27:00–02:27:30]
only meeting TSI criteria. And when we say TSI criteria, I was just gonna pause you. Can you just
remind everybody what TSI criteria are? It's perfect. Yes, I can. So TSI is one way that we really
think about measuring college readiness. And it includes meeting a threshold in the SAT, the ACT, or
the TSIA 2.0 test, which is basically the Texas equivalent of the SAT. And so if you meet the math
and the reading threshold in one of those tests, you'll meet TSI.

[02:27:30–02:28:00]
There's one distinction to call out here, which is that in the board report, we're really looking at
TSI assessments, so the SAT, ACT, and TSIA. But for the accountability system, you can also meet TSI
by passing a course called the Texas College Bridge course. That's not included in this data because
it doesn't count towards the the um, it's not how we calculated the baseline, and it doesn't count
towards the outcomes bonus, but it is one other way you can meet TSI, and I'll talk a little bit
about that as a",1
74,2:28:00,2:30:00,"[02:28:00–02:28:30]
part of this conversation. But it's meeting the threshold on those tests. If you are TSI ready as a
student, it's really important for going to college because it removes the requirement to do
remedial coursework in college. And a lot of our data shows if students have to do that remedial
coursework, they end up dropping out of college. And so it's a really strong indicator of college
readiness. And so we look at it here in 3.1 for 11th graders and again it's just looking at the TSI
in in 3.1 it's not looking at TSI and IBCs.

[02:28:30–02:29:00]
And it's important here because in 11th grade, that's really the first time they're taking these
assessments. Historically, in HISD in 11th grade, we do a district-wide SAT day. So it's really the
first time students are exposed to one of these assessments. So it's important to measure here. In
figure seven, we show that again we did meet the goal for 11th grade students who are TSI ready. And
so you can see that in the graph on the far left. And then in the middle, it breaks down by
subpopulation. What we see here is our Hispanic students are really driving our.

[02:29:00–02:29:30]
ability to meet this goal. So we do need to be very mindful of supporting students to be TSI ready
pretty much across all other subpopulations. And then in the graph furthest to the right, it breaks
it down by reading and math and both. And so here, what we have seen is that kids are historically
doing considerably better on the reading portion of the assessments than the math portion of the
assessment. So the math are driving down our overall ability for TSI readiness. But the math did
increase this.",1
