chunk_id,window_start,window_end,text,binary_hit
38,1:16:00,1:18:00,"[01:16:00–01:16:30]
directors do we have a motion um oh okay um I would like to make a motion that we allocate 128 votes
to Bill Fraser and forty two votes to Mike Sullivan for the HCAD vote board second it has been moved
by Courtney Anderson and seconded

[01:17:00–01:17:30]
by David Slattery. Is there any discussion? Those in favor say aye. Aye. Those opposed say no. The
motion is approved by a vote of seven to zero. The next item on the agenda is a discussion and
possible action on DIT's DITS academic calendar recommendations for the 2025 2026 and 2026 2027
calendar. Dr. Blaine.

[01:17:30–01:18:00]
Yes, I believe we're going to have a very short presentation on this just to talk a little bit about
the survey results. And Linda, I'll let you I'll turn this over to you. Thank you so much. Good
evening, President Alpe, Dr. Blaine, and Trustees. This is that time every two years when we bring
before the Board of Trustees the recommendations for approval of the academic calendars for the
upcoming two years. And in your board agenda pack up packet, and I now see up on the screen, you
have both the two recommended calendars as well as the survey results that led to the
recommendations. As way of background for many years, the district.",0
39,1:18:00,1:20:00,"[01:18:00–01:18:30]
improvement team has served as the broad-based stakeholder group that also serves as the district's
calendar committee. As a reminder, the DIT is comprised of certified staff, parents, students, and
partners from across the district. So we have a broad base of perspectives as we work to develop the
best academic calendars for the system. For a long time, people wanted us to do the best vacation
calendar for the system or summer camp calendar for the system, but our emphasis is really always on
what is the best academically for our students.

[01:18:30–01:19:00]
I really want to thank all the members of the district improvement team who worked on the calendar,
and I also really want to thank my partner in this work for many years, Dr. Lance Stahlworth, who's
led the DIT through this process, as well as Mike Thomas, who always leads our calendar survey
process. So at this time, I'm pleased to invite to the podium Dr. Stallworth to share a little bit
about the highlights of how the process worked and what the survey findings were and the
recommendations for which we're requesting your approval tonight. I do want to point out as Lance
comes to the podium, the language noted at the bottom of the calendars affirms that the

[01:19:00–01:19:30]
calendars are subject to any change that may happen in an upcoming legislative session or anything
that's an unforeseen circumstance for which we could not, you know, have any indication at this
point. And I also want to note on the 26-27 calendar that there's also language there noting this
calendar is subject to the renewal of the district's district of innovation or DOI status. As a
district of innovation, one of the state laws the district has always exempted since we became a DOI
close to 10 years ago is the one requiring that.

[01:19:30–01:20:00]
districts start school no earlier than the fourth Monday in August. And we've exempted that. And
because our DOI plan runs through January of 2026, that plan would have to be renewed prior to that
26 27 calendar actually coming into place. So with that, I'll turn over to Dr. Solworth. Good
evening. As Linda shared, SBIC has a long tradition of developing academic calendars on a two year
cycle. This past summer we began the work of developing the 2025 2020.",0
40,1:20:00,1:22:00,"[01:20:00–01:20:30]
2025 2026 and 2026-2027 school year calendars. During the summer, a subgroup of DIT members
volunteered to develop two options for each year under consideration. The two calendar options for
each year were then brought to the full DIT in September for the review and consideration. Based on
their feedback, a few tweaks were made to both sets of the options. At the October DIT meeting, the
DIT took one last look at the calendar options and agreed that they were the options they wanted to
put in front of the community for feedback. Shortly after the DIT meeting, senior staff reviewed the
calendar options and agreed to move forward with.

[01:20:30–01:21:00]
Then agreed to move forward with the community survey. The calendar survey was launched for staff
and community feedback on October 21st and was available for people to respond through October 30th.
Several reminders were sent to the community and staff inviting them to participate in the survey.
This year we had a record number of responses with over 5,000 people participating. For the 2025
2026 school year, participants overwhelmingly selected the calendar option that starts on October
13th and ends before Memorial Day on May 22nd. This calendar is the

[01:21:30–01:22:00]
DIT recommendation for 2025-2026. For the 2026-2027 school year, participants were evenly split
between the two calendar options, with a very slight majority preferring the calendar with a three-
day Easter weekend in late March and May 26th as the last school day. A close minority of
respondents preferred a four-day break for Easter weekend and a last school day of May 27th.",1
41,1:22:00,1:24:00,"[01:22:00–01:22:30]
November meeting that with a close vote from the survey for 26-27, we as an administration looked
more closely at the implications of each option for that year, and our recommendation for the
calendar was that one ending on May 26th. The most compelling concern of administration was the
impact of summer school for that summer of 2027. Ending the regular school year on May 27th of that
year will result in students coming back from the 4th of July weekend for one last day of summer
school on Monday.

[01:22:30–01:23:00]
Monday, July 5th. If we get out on May 26th, it allows us to end summer school for elementary and
middle school students on Thursday, July 1st, so they don't have to return after that long weekend.
So we we felt that was a compelling reason to really lean towards the calendar that ended on May
26th. So after considering the majority survey vote and the administration's recommendation, the DIT
is recommending the 2026 2027 calendar that begins on August 13th and ends before Memorial Day on
memor on May 26th.

[01:23:00–01:23:30]
So at this point, we'll just ask it. Do you have any questions? Do we have a motion? So moved.
Second. It has been moved by Shannon Mayhan and seconded by Chris Ernest. Is there any discussion?
All those in favor say aye. Those opposed say no. The motion is approved by a vote of seven to zero
that we approve the DITS academic calendar recommendation.

[01:23:30–01:24:00]
Calendar recommendations for 2025-2026 and 2026-2027. The next item on the agenda is executive
session. The board will now adjourn into executive session under the following sections of the Texas
Open Meetings Act. Section 551.074, Section 551.0821, Section 551.076, and Section 551.071.",0
42,1:24:00,1:26:00,"[01:24:00–01:24:30]
This meeting is now reconvened in open session in compliance with the provisions of the open
meetings laws of the state of Texas. The time is now 8:31. The executive session just completed has
been held for discussion of topics as allowed by law. No action was taken. The next item on the
agenda is a request for approval of routine personnel. Do we have a motion? So moved. Second. It has
been moved by John Perez and seconded by Shannon Mahan. Is there any discussion? Those in favor say
aye. Aye. Those opposed say no. The motion is approved.

[01:24:30–01:25:00]
by a vote of seven to zero that we approve routine personnel item. The next item on the agenda, and
I am tabling 7B to a later date. The next item on the agenda is consent agenda action items. All
items listed under this agenda item are considered to be routine by the Board of Trustees and will
be enacted with one motion. There will be no separate discussion of items unless a board member so
request, in which event the items will be removed from the consent agenda and considered as an item
for.

[01:25:30–01:26:00]
a separate vote. Is there any such request? I need to request 11G to be pulled out. I'm going to
abstain from that vote. I'd like to pull out 11C6 for discussion. Okay. Anyone else? All right. So
except for 11 C6 and 11G, do we have a motion? So moved. Second. It has been moved by John Perez and
secretary.",0
43,1:26:00,1:28:00,"[01:26:00–01:26:30]
And seconded by Caroline H. Bennett that we approve routine. I mean, I'm sorry, that we approve
consent agenda action items except for 11C6 and 11G. All those in favor say aye. Aye. All those
opposed say no. The motion is approved by a vote of seven to zero that we approve consent agenda
action items. For the first one pulled out 11C6. John, you wanted to pull that out? I did.

[01:26:30–01:27:00]
So I'm not sure if someone needs to come up and speak to this, but I wanted to say so a couple of
meetings ago, or maybe it was two or three meetings ago, um, this came up through consent agenda.
And where we landed was if we could see a breakdown of what these different professional development
services were actually doing, maybe how much we spent on them, that would be great. So I do
appreciate the work that's been done to uh provide that table. Uh and I guess now where where I've
landed is I think what I'm seeing with the consent agenda item is you're asking for twelve point
five million.

[01:27:00–01:27:30]
$12.5 million in approval with a projected spend or budgeted spend of about $2.5 million in each of
one of five years. And I guess if I'd done the math right, uh, I didn't have it added up for me, but
if I take the totals of everything across the three or so pages, I'm seeing that in the last five
years and plus the budgeted sixth year of 2025, which I'm not sure if you spent all that, but let's
just all the numbers on this table, I'm seeing a total of 2.9.

[01:27:30–01:28:00]
Of 2.935 million. And so let's just say you divide that by five or six. You're looking at a half
million dollar spend per year. So I'm just wondering maybe someone can help me understand why we
you're being why we're being asked to approve five times what you've spent. And when you look at
that, it it begs the question of you're budgeting two and a half million per year when you've only
spent half a million. That two million can pay for something like Benwood or",1
44,1:28:00,1:30:00,"[01:28:00–01:28:30]
So I I would like to understand why we wouldn't be allocating that money elsewhere given our
historical spend. And I was curious maybe why that wasn't done before it was sent to us or sent back
to us after someone actually looked at the numbers. So I I just want to understand.

[01:28:30–01:29:00]
various allocations. For one of them a campus. And they're given allocated campuses. Or allocated
dollars. And so they may say, you know, this is a year I want to focus on a math type of program. So
I'm I'm setting aside money. So I would never tell a campus, nope, you can't spend it on
professional development because we didn't spend that much last year. We're going to take that from
you to pay for something else. So that part of that argument doesn't work for specific campuses,
maybe. But at the department level, I mean

[01:29:00–01:29:30]
these are based on discussions of planned purchases. We're about to have a very large reading
program change, and so there'll be some more there'll be some uh professional development tied to
that. Yes, we could cut we could taper off of that. I mean, that's not a problem, but if we then
butt up against that at the end of the five years, we would just bring it back to the board. It's
not necessarily that there is two and a half million set aside in a budget. There would be, I
wouldn't be able to cut.",0
45,1:30:00,1:32:00,"[01:30:00–01:30:30]
two and a half million out of the budget to then pay for something else. This is just contracting
authority. In the end, there has to be money in the budget to pay for it first. Right. But in the
budget information, you say the estimated annual expenditure for this contract is two and a half
million for a total expenditure of 12.5 over five years. So you do have two and a half budgeted to
spend somewhere across the campuses, and our historical spend is about half a million. So it just
seems that we're saying, you know, I mean, just I'm just looking at my household, right? It's like,
hey,

[01:30:30–01:31:00]
John August, here's five times more than what you need in college. Really hope you don't spend it,
but just in case you do, here it is. I mean, I just I wouldn't do that, right? I mean, so I just
want the two and a half, it's about contract allotment. It's a allowable spend, does not mean we
literally have two and a half million dollars budgeted only for professional development. It allows
for up to that. That's what the contract, that's what you would be approving. So, where is that
money budgeted then if you don't have it allocated? It could be currently in a supply budget.

[01:31:00–01:31:30]
and they go wait a minute I don't need supplies I want to put it in professional development. But by
us approving this though, aren't we saying that hey we are I mean somehow we are earmarking that
money. I mean that's that's kind of what we're doing by approving this. We're earmarking that money
for available spend. And if we're not then some of what was said during public comments kind of gets
raised as to are we sandbagging here, right? No, there's absolutely no sandbagging happening. But I
don't think that's the case so it's it's not necessarily that the money it it's right now when um

[01:31:30–01:32:00]
Um think of another example. When we approve the contract for um electricity, I make an estimate on
what that cost is going to be. And if we get to that amount, I'll have to make sure that I move
money around to if I didn't already have it set aside. It really is just allowing for the purchase,
but in the end, somebody has to have the money in their budget to actually do the requisition to
actually get the purchase order. Totally, I can taper off on that. Yeah, I guess I'll I would have
seen",1
46,1:32:00,1:34:00,"[01:32:00–01:32:30]
I would have expected some tapering off. And the other thing is when I look at the services, there
are a good number of them that we've never spent money on. So why would we give kind of a blanket?
And I get, for example, Texas Reads is a good example where we had we had we had to activate that.
But couldn't we pick some that could come off the list altogether and not provide that potential
allowance? I guess is how you're trying to explain it. And then I would also question, for example,
connection capacity. We spent about a hundred thousand, but I'd like to better understand connection
capacity.

[01:32:30–01:33:00]
because it seems like there's some just SEL stuff in there, and I wouldn't mind understanding that,
as well as Harris County Department of Education. I think we spent $350 across two years, but I
don't know. I'm not a fan of just kind of giving blanket approval to spend anything on Harris County
right now. I mean just personal bias, I'll be honest. Well Harris County Department of Ed offers
lots of various services, not necessarily uh academic may not use them as much, but

[01:33:00–01:33:30]
other areas do. Um but this was a focus on the academic professional development I'll say on that.
So am I Christine just so I understand I guess his questions and your responses, are you saying that
just because we approve a contract for two and a half million what you budget for say professional
development is two and a half million or it's something lesser? Or it's up to the individual campus
with their",1
47,1:34:00,1:36:00,"[01:34:00–01:34:30]
whole budget, what they spend on professional development. Probably a little bit of at least two of
those things. There, I could not run a budget and get two and a half million dollars focused on only
professional development right now. I couldn't like run it across the district to get that. But a
campus or department can decide I'm going to spend some money and plan at the beginning of the year,
but maybe not plan at the beginning of the year, realize that, and I think academics is a good
example of that, may realize well, we need to.

[01:34:30–01:35:00]
focus on something, and it's January, so I'm gonna move some money around. Annie may have the money
budgeted in a certain uh plan to spend on supplies, a specific supply, but decide instead to do it
into professional development. But at the um the plan to spend two and a half million, no, that's
not literally in the budget right now. It really is just allowing for people to make decisions
throughout the year. And these are the list of where we

[01:35:00–01:35:30]
spent money, it's possible there's vendors that didn't make this list that we spent money on last
year. Could bring up some of that. It's not gonna, it will not make our no way we'll get all the way
to that whole amount. Additionally, our teams know like this is your chance to catch all. So if you
think that you're going to need something in the next few years, it really needs to be on the RFP
for professional learning. So just some examples of that. Like when I look through here at some of
the zeroed out like Stetson and Associates, that's the group that's doing our 504 audit, you know.

[01:35:30–01:36:00]
anticipating would we need any professional learning? Maybe, I don't know. You know, like we can't
do business with them if they hadn't been approved through the RFP. And I don't know what that cost
would be. Other things on here, like Sandra Mercury is on here who works with our multilingual
department, and those are title funds that will fund that and dollars that we have to spend for
emergent bilingual supports in some cases. So it's different funding sources. Some are general, but
a lot would be title. We use Title II a lot for professional development as well. But you mentioned
one connection.",0
48,1:36:00,1:38:00,"[01:36:00–01:36:30]
capacity, so I asked Tyra if she could just give a little overview of what connection capacity is.
Okay. Okay, good evening. I would um as far as connection capacity, even though it falls under SEL,
it's really positive behavioral intervention support. So it's to support the behavior in our
district. What we see is we have behavior at all different levels, but where we have the greatest
amount of behavior is an elementary. So when we have situations happening on campus.

[01:36:30–01:37:00]
Happening on campuses. The team that I oversee supports that work, so they have to be trained with
fidelity to make sure that they can then go in and train all the staff on the campuses. So a lot of
times people will bring in training or send people out for training. We don't have the capacity to
be able to send people out for training because whenever teachers miss classroom time and classroom
instruction, then by going out to training, instead, we have a model where we train the trainer.

[01:37:00–01:37:30]
So we bring people in and they centralize and really train our people with a great level of fidelity
to be able to go out and provide those supports on the campuses for the students. But not only that,
they also then turn around and go in and train the adults. So they've come in and they've also
trained across the district for like leadership you. They've trained all of our leadership and our
administrators as well, our instructional leadership teams on campuses. They do our fidelity.

[01:37:30–01:38:00]
Fidelity set visits, and that's where we go in on campuses just to see if the positive behavior
intervention supports system is working, and then give feedback to campus principals and teams to be
able to support that work. Without that, what we'd have is a situation in which we'd have students
that would interrupt the academic learning for several students because if we have a student in a
classroom that's exhibiting inappropriate behavior that affects the learning for all, then it",0
49,1:38:00,1:40:00,"[01:38:30–01:39:00]
All then at some point that's going to shut down the academic learning for a number of students in
that classroom. So we like to make sure that we have those supports, both teacher-facing and
student-facing. We've had several different um institutions come and provide quotes opportunities,
but for the amount of support and work that we've gotten out of this specific um institution, it's
been, you know, very worthwhile. We've trained at this point all but eight.

[01:39:00–01:39:30]
13 campuses in PBIS with the amount of money we've spent um with commun connection capacity. Any
other questions? Because I'd like to be able to make sure I give enough information. Is PBIS uh
similar to restorative justice uh or restorative discipline? Well what's the difference between PBIS
and restorative discipline or restorative justice? Yeah, restore restorative justice is more about
students um

[01:39:30–01:40:00]
When students basically make certain decisions that aren't appropriate in an academic setting, and
it causes them to basically ruin relationships, sometimes with peers, sometimes with teachers.
Restorative justice calls for them to go back and reconcile those relationships that they have at
some point, you know, damaged in the process. So we've have we had students where we make sure they
go back and restore.",0
50,1:40:00,1:42:00,"[01:40:00–01:40:30]
those relationships, yes. But PBIS is more about training people to manage their classrooms more
effectively. It's more about intervention support. So it has to do with the behavior. So when kids
act up, we go in and we teach kids how to change and replace those negative behaviors by giving them
positive behaviors that they could do instead. So when they get upset, we've taught them how to at
some point go and use their words more positively.

[01:40:30–01:41:00]
Positively based on the younger ones. We'll we'll teach them certain strategies and coping
mechanisms, how to do countdowns, how to you know do mindfulness activities for their age
appropriateness, depending on whether they're elementary, because it goes all the way through high
school. But we spend a whole lot more time with the younger kids, and we teach teachers how to set
their classrooms up to be able to support students. If a student is acting out, we use proximity, we
use different strategies to when a kid exhibits

[01:41:00–01:41:30]
Exhibits a behavior instead of doing things that's going to escalate that student, we try to find
ways to diminish those behaviors in the classroom and we teach teachers those coping skills as well
as students those skills. So sometimes we're in the classroom if we have, and it depends on the tier
of the kid. Tier means that, you know, tier one is where kids are all going to get, all kids have
tier one behaviors. They get frustrated and they may, you know, act out or lash out or say something
inappropriate. It's helping the teacher be able to manage that effectively.

[01:41:30–01:42:00]
but more importantly, it's also working with that student so that when you get frustrated, what are
you going to do? How do you use your words to be able to explain how you really feel and what you
need? Because a lot of times kids are going to act out. There's an antecedent to every behavior that
a kid is going to exhibit. So you want to make sure that you're finding out what is causing and
triggering that behavior, and then how do you get that kid to come back on the backside and do
something different to be able to reconcile their feelings about it? Tyra, can I add to that?",0
51,1:42:00,1:44:00,"[01:42:30–01:43:00]
That um a lot of times, John, when you have disruptive students in your class, especially the little
ones, the you know, they may have, you know, they may tear up the classroom, they may hit other
kids, they may hit the teacher, they shut down the entire classroom. We heard about student at
Bunker Hill a couple years ago. Like, and then when you sit down and try to get testing for these
kids, the first thing that you kind of have to go through in the in a 504 process or an art process
is what have you done with those students?

[01:43:00–01:43:30]
Students before we're going to take them into a more restrictive environment, taking them out of a
home class. So you have to say, like, these teachers have they're given points. Some teachers use
point systems with these kids. Some use, you know, different kinds of rewards for the behaviors,
especially the little ones. We get a lot of pre K and kindergartners who've never been in class and
they're super disruptive. You don't know what they have, but we also can't start testing them until
we've gone through all of the because the state says you have to have the students in the least
restrictive environment legally. So we have to jump.

[01:43:30–01:44:00]
through a lot of hoops. So the PBIS, uh, that's been around for so long, and it kind of helps the
teachers and the administrators scaffold and get these kids where the right place where they should
be. And it also provides a common language across the campus and every setting and environment on
the campus so that they know exactly if you're going in the cafeteria, this is what needs to happen.
If you go into the classroom, this is what needs to happen. Just it just basically gives everybody
the same understanding of what needs to happen across the campus.",0
