chunk_id,window_start,window_end,text,binary_hit
31,1:02:00,1:04:00,"[01:02:00–01:02:30]
What we have to lose in HISD. I have seen firsthand the scars it causes. I was a first-year teacher
where we had a violent incident on campus and a student was stabbed to death. Three other students
were injured. And you want to tell me what your fight was someone coming in with an assault rifle
and having free reign. Thank you, Ms. Dowda. Thank you, Miss Dowd. When locked classroom doors, save

[01:02:30–01:03:00]
Save flags of children. Ma'am, thank you. Our next speaker is ma'am. This thank you. That is one
morning. Amanda Ferris is our next speaker. Hello. I'm Amanda Ferris. Um I'm pretty embarrassed by
um you guys' idea of what a quality education is. Take a look at these worksheets. This is what our
kids are doing all day. There's no it's all multiple choice. You're not engaging.

[01:03:00–01:03:30]
their minds, you're not allowing them to write out their answers. This is embarrassing. Y'all should
be absolutely embarrassed. No trust, no bond. Thank you. Our next speaker is Christina Acosta.
Hello, everyone. My name is Christina Acosta. I will not address you. I will address the people. I
am Christina Acosta, and I'm a proud VIPS parent volunteer for over 12 years. I stopped working in
first grade to be with my children.

[01:03:30–01:04:00]
and their education. Through my church, Numa, Numa Church, I found out about Navarro Middle School.
Through Navarro Middle School, I found the wraparound specialist, Stephen Dolce. Through the
wraparound specialist, I found out that Navarro, Yolanda Black Navarro Middle School has a pool. Did
you guys know that they have a pool on the third floor? So I went to Pew Elementary to speak to Mike
Miles. Well, I didn't go there to speak to him, but after seeing everyone speaking, I had the
courage to speak.",0
32,1:04:00,1:06:00,"[01:04:30–01:05:00]
and tell them the first thing was fix our ACs, fix our heaters, and I needed to know uh for our
school supply pilots. So those are the three things and now we have this project moving. That is it.
Thank you, ma'am. Ma'am ma'am, your time is up. You should have gotten the budget for nine thousand
and now you can work. Our next speaker is Diana Candida.

[01:05:00–01:05:30]
Yes, ma'am. Hello, my name is Diana Candida, speaking on behalf of a parent at Neff who is now
considering taking her child out of the school because of the chaos created by Mike Miles's
policies. Teachers are being fired, emergent bilingual students are not given the support they need,
and parents are angry and frustrated. She says, our feelings are hurt. All you want is money. We
don't care about money. We care about our kids, our education. You're removing our teachers without
saying why.

[01:05:30–01:06:00]
Why you're ignoring us as parents. We are raising our voices to say stop doing this. And she also
says this. Let me see if I can think. Please don't hurt any more our children, our community. Stop
doing this. Please remove Mr. Mike Miles from his chair. He doesn't deserve staying there at that
chair. So Miles is destroying our schools while also asking working families to foot the bill for
the bond. No trust, no bond.",0
33,1:06:00,1:08:00,"[01:06:00–01:06:30]
Thank you. Our next speaker is Kelly Bleaker. Recent data shows that uncertified teachers leave at a
rate three times higher than certified ones. I was once a certified teacher, uncertified teacher.
Teaching is hard. Teaching with no classroom experience and minimal training is overwhelmingly hard.
Any success I had didn't come from district feedback or curriculum or Teach for America. It came
from the support of veteran staff at my school who counted.

[01:06:30–01:07:00]
Who counseled me through missteps, shared best practices, knew the specific needs of my students,
and taught by example how to meet them. In light of the mass exodus of veteran teachers and admins
under your leadership, I ask you who will support HISD's 2,000 uncertified teachers to ensure
success and stability for our students? New teachers do not need error ridden slides and AI
generated packets. They need true mentorship. Not a supervisor looming like a sweatshop foreman
accounting for every minute not devoted to test prep. No trust, no bond.

[01:07:00–01:07:30]
Thank you. Our last speaker in person is Carly Paget. Ms. Paget? Good evening. I have been in
correspondence with teachers who decided to stay. They are committed and dedicated, certified
teachers who experienced turmoil and chaos last year and still decided to come back. They have more
gumption than I did.

[01:07:30–01:08:00]
because I'm gone. I asked them if there was anything that they wanted the public to know, and they
really wanted to emphasize that we have 20 year certified teachers who are dedicated to their
campuses, who are witnessing a 5 to 6% decrease in pay and are being paid less than new uncertified
teachers. Mr. Martinez, could you imagine getting a 6% decrease in your pay for no reason at all,
other than budgetary differences?",1
34,1:08:00,1:10:00,"[01:08:30–01:09:00]
from a new new owner. Miss Mona. Thank you, ma'am. Thank you, ma'am. Thank you. Thank you. We'll now
switch to our Zoom speakers. Oh, we have one more? Who's in person? Miss Silva? Oh, yes, ma'am.
Hello. Hey Mike. Recently you visited Crocodile.

[01:09:00–01:09:30]
Maybe you visited Crockett Elementary for the first time ever. I was actually at the school
volunteering upon your arrival. It's a beautiful campus, wouldn't you agree? You say you're a lover
of the arts. However, you passed by all of our fine art magnet classes on your way to see third
through fifth and third through fifth only. And they're team centers. You didn't peek your head
inside orchestra, you didn't check out our tiny dancers, you didn't pop your head inside percussion,
choir, or visual art. You came only to see our star testing age kids, and you ignored every other
amazing part of our school. Kindergarten teachers can't even read.

[01:09:30–01:10:00]
their students' books in class, and you didn't even stop to make sure they weren't doing that. Our
school is so much more than star scores. I wish you would have checked out the rest of it. Thank
you. Ms. Schmidt, does that conclude our in person speakers? Okay, so let's go to our Zoom speakers.
And I'll just let you call them, please. I have Di Yadira Ariano. Please turn your camera on and you
may be good.",0
35,1:10:00,1:12:00,"[01:10:00–01:10:30]
As a Houstonian and an HISD class of 1998, I have to stand in solidarity with our HISD family. And I
have to uplift the Peyton family in their support for justice for Landon Peyton. I have a different
thing to bring up. Following the Georgia school shooting.

[01:10:30–01:11:00]
for high school students came home with two flyers on one from the HISD police department and the
other from SafeGunStorageTexas.com. Neither of these flyers helped our students feel safer. Number
three, family concerns over lack of temperature protocols in schools are of major concern for
students and teachers.

[01:11:00–01:11:30]
The four point Claude Bittner, you may begin. Can you hear me? My name is Claude Bittner, and I'm an
HISD parent speaking on behalf of a certified teacher who is afraid of retaliation. She says, I'm
writing to formally express my concerns regarding the extreme stress and anxiety I've been
experiencing due to recent circumstances.

[01:11:30–01:12:00]
with an HISD. As a result of this ongoing stress, I have serious concerns about the potential impact
on my health and on the well being of my unborn child. I believe that the high levels of stress I'm
enduring might pose risks to both my physical and mental health and to the health of my baby. Board
of managers, wouldn't you be embarrassed if employees were treated this way at your places of work?
Aren't you ashamed of being in a district where pregnant teachers feel that their work environment
is so toxic that it affects their unborn child? Can you do any better? No trust. No bond.",0
36,1:12:00,1:14:00,"[01:12:00–01:12:30]
Thank you. Dr. Pamela Bovlin, please turn your camera on. You may begin. All right. I'm gonna be
brief. My name is Dr. Pamela Bovlin, and I have spoken to you monthly nearly over the last two
years. No to deleting TA to you going as a delegate to the Texas Association of School Boards. You
are not a school board. You don't go. Period. No to remove.

[01:13:00–01:13:30]
To removing homebound services and making them remote? Are you kidding me? That's ridiculous. My
granddaughter's homebound. The contact she has with other humans is even vital to her learning. No,
to selling our land and then bringing it into the general fund to try to make up for a deficit you
created. No to open door policy that risks the safety of our children from F miles million.

[01:13:30–01:14:00]
F miles militaristic ideas. It costs zero dollars to create a safe environment for our children.
Close the door. Maria Calzana, please turn your camera on. You may begin. Hi, uh Maria Calzana and
sorry, I see two. Um I'm here uh I have uh two kids.",0
37,1:14:00,1:16:00,"[01:14:00–01:14:30]
who've gone through HISD um here um to speak about teacher certification and um also to mention that
um I hear a lot of talk about um trying to save you know brown and black schools and um particularly
on the cusp of uh uh Hispanic Heritage Month um Carnegie Vanguard is a brown and black school um and
um we are um uh a

[01:14:30–01:15:00]
uh uh the um uh diversity is our strength and i i um i want to um highlight that um also um uh want
to um uh mention a few things that uh teachers um both um at the school and around the district have
mentioned about certification which has been highlighted by other people um and also students have
been complaining about the open door policy as well as other teachers and parents thank you um it's

[01:15:00–01:15:30]
Alison Chapin, please turn your camera on. You may begin. Good evening. My name is Alison Chapin.
Sorry I couldn't be there with you this evening. Um, I am here to say uh no to sending somebody to
TSAB. You are not our school board, you are appointed by well, people from Austin. No to cherry pick
data.

[01:15:30–01:16:00]
Mr. Miles is very good at cherry picking his data. No to more money via taxes. And please,
taxpayers, understand that they say there won't be any increase in your taxes with the bond.
However, you will be paying for 30 plus years over 10 billion dollars. Anyway, also uh they do not
have to uh spend the money other than like they don't have to spend the money on what they say
they're gonna spend it on.",0
38,1:16:00,1:18:00,"[01:16:00–01:16:30]
They're going to spend it on. They can spend it on maintenance and operations any way they want. No
to removing homebound services, and certainly no to the sale of property to and the money going to
the general fund. Thank you. Victoria Holtman Bryan, please turn your camera on. You may begin.
Hello, my name is Victoria Huttman-Bryan. To achieve the goals laid out in constraint number one,
the district claims that is providing high-quality curriculum to all schools.

[01:17:00–01:17:30]
This is patently false. The district's curriculum for elementary is abominable. It is beyond boring.
It is cruel. Pre K through fifth are watching slides and taking quizzes, regardless of the school's
autonomy level, because the teachers are being evaluated not by how well they teach, but by if they
robotically follow the district's absurdly age inappropriate model. My heart breaks for my best
friend's child who is in kinder at Burbank Elementary School, a B rated campus in 2223 and 2324. Due
to the use of the district's curriculum in nearly every

[01:17:30–01:18:00]
subject. She has gone from being a self-directed reader at a third grade reading level and reveling
in doing multiplication to saying she quote hates learning and she wishes she quote never had to go
to school again. You all should be ashamed for allowing this. Let teachers teach and let kids love
learning. Jesse Heiner, please turn your camera on. You may begin. Hello, can you hear me? Yes, go
ahead.",0
39,1:18:00,1:20:00,"[01:18:00–01:18:30]
Thank you. Okay. Um, good evening. I'm not able to speak in person today because I am volunteering
at our NES Schools open house. I hope members of the board of managers will ask why NES campuses
continue to hold events and demo days the same day as board meetings. Wainwright Elementary is one
of the schools that magically went from an F to an A rating. Neither of these ratings were are from
TEA because TEA has been blocked in court in court from publishing any ratings for the last two
years.

[01:18:30–01:19:00]
To the board of managers, think about the legacy that you're leaving by supporting a person who is
publishing these magical ratings while that person runs the district through the lens of a
prediction ring hanging around his neck. Everyone in the room say it with me. No trust, no bond. No
trust, no bond. No trust, no bond. No trust, no bond. No. Christine Hurley, please turn your camera
on. You may begin.

[01:19:00–01:19:30]
Okay, just a second. Okay. Sorry. As a woman, I'm unfortunately unsurprised when my opinions, views,
thoughts, and ideas are dismissed and invalidated by men. I was surprised, however, to see it
already happened to my eight-year-old daughter last month. She stood before you and spoke about how
she and her friends do not like the teen center, along with the majority of the children at her.

[01:19:30–01:20:00]
school. And what was one of the first things out of Mike Miles' mouth? Dismissal of her lived
experience, saying kids love the team center. How hard would it have been to simply acknowledge a
child's voice and her reality? I assume it's nearly impossible for a coward, and that's why we never
hear accountability from Mike Miles. Admit that NES doesn't meet the needs of any student needing
individualized education, such as GT Fed or ELLs. Admit that the curriculum the district is forcing
on schools is hastily thrown together a mere week before it's to be taught. Admit that instead of
spending money on AED batteries, you set my elementary",0
40,1:20:00,1:22:00,"[01:20:00–01:20:30]
We set my elementary school an entire palette of unwanted adult spin bites. Admit that came schools
as a failure. Thank you. Tom Harley, please turn your camera on. You may begin.

[01:20:30–01:21:00]
School. They told you how they and their classmates did not like the team centers. At first, I was
extremely angry that Mike Miles basically called them liars. As soon as it was his turn to speak, he
dismissed their experiences by telling the board that the reality was how much all the children
loved the team centers. I know that some students do love the team centers and they are beneficial
to some students. Maybe the disconnect is with GT students. We were told the GT program would not be
altered when the school became NES. But in typical NES fashion, a one size fits all ideology was
applied and every student was consistently pushed out to the team center with worksheets that did
not challenge.

[01:21:30–01:22:00]
them while the teacher sat in an empty classroom. Hence, the reality is that not every child loves
the team centers. I cannot understand why you refuse to listen to honest feedback from the students
on the other end of your untested program. Wouldn't it make sense to take the feedback seriously and
make adjustments, make it better, continue to improve? So when this is all over, the NES program
will not be remembered as a complete failure? Let's be honest, over and over you have shown that
there will never be trust. Thank you, Mr. Riley.",0
41,1:22:00,1:24:00,"[01:22:00–01:22:30]
Martinez, please turn your camera on. You may begin. Hi, I am Janelle Martinez. I'm actually
currently a student at Westbury High School with a GPA of 4.5. And I can tell you that this is not
fair. My sister actually wrote the letter about Emerge and how it was better, and you actually
enjoyed learning. And not have teachers who literally don't know what to do in case of an emergency.
Actually, around two weeks.

[01:22:30–01:23:00]
ago, I since the doors were open, I heard a student having a panic attack and st and little teachers
screaming, What should we do? until a student from my class had to stand up and go and tell them to
call the emergency and had to take out her phone from her backpack and call 911 because nobody did
anything. It is unacceptable.

[01:23:00–01:23:30]
Thank you, ma'am. Carolyn Shipp, you may begin. Ms. Ship, please turn your microphone on. You may
begin. I'm a retired HISD teacher of thirty-eight.

[01:23:30–01:24:00]
Teacher of 38 years with three grandchildren in the district. Here today to talk about goal three
point one. Uh my name is Carol Ann Ship. I'm a retired HISD teacher of 38 years with three
grandchildren in the district. Here today to talk about goal 3.1, the percent of 11th graders. Um
here today to talk about goal 3.1, the percent of 11th graders meeting TSI criteria.",0
42,1:24:00,1:26:00,"[01:24:00–01:24:30]
Ma'am, you're gonna you you're hearing yourself. I think you have to mute the sound back. We can
hear you fine, so if you can continue, please. Maybe we need to come back to her. We'll come back to
you, ma'am.

[01:24:30–01:25:00]
Pranjal Sivastrava. You may begin. Hi, good evening. Good evening. My name is uh Panjal Sivasva. I'm
an HISD parent. Um I I wanted to talk about the other mismanagement that's going on in HISD.
Students are dying on campus, nurses are not trained, ACs are not working. Um

[01:25:30–01:26:00]
Students are having to miss class classroom teaching because of ACs. Teachers are living in uh mass
droves. If this is what you call a successful education, then I think you should be ashamed of what
you're trying to uh percolate here. I'm surprised that you guys have not resigned because this is
not being this is not helping the parents in the district. The image that comes to my mind is about
Emperor.",0
43,1:26:00,1:28:00,"[01:26:00–01:26:30]
Yeah, Emperor Nero playing the fiddle while Rome was burning around him. You are burning HISG to the
ground. That's what is happening today. Thank you. Miss Shep, please go ahead. Uh sorry for earlier.
Uh I'm a resired HISB for 38 years with three grandchildren in the district. Here today to talk
about goal 3.1, the percent of 11th graders meeting TSI criteria on SAT AC.

[01:26:30–01:27:00]
SAT, ACT, or TSI in both math and reading, will increase from 15% in May 2023 to 30% in May 2028. I
failed to see how the current AI-generated curriculum can prepare anyone for advanced testing. The
10th grade English lesson that I saw tried to cram eight poetry conventions in one lesson about an
uninspiring poem with tedious rhymes. Students in English classes need to read and discuss with
teachers the concepts and ideas that they read in plays and novels because.

[01:27:00–01:27:30]
And novels with recurring themes. Continuing with the current English curriculum will not prepare
students for life after high school. Thank you. Mr. Tamborillo, please turn your camera on. You may
begin. We can't hear you.

[01:27:30–01:28:00]
I said on mute. Thank you. Um I am very concerned about the proposed bond for the Houston HISD under
uh Mike Miles' leadership. Someone who employs a Shell corporation to move Texas taxpayers' school
funds to an out-of-state for-profit corporation has no business asking taxpayers for four point four
billion dollars. When Miles began as superintendent HIC at a projected twenty-three to twenty-four",0
44,1:28:00,1:30:00,"[01:28:00–01:28:30]
Budget deficit of $99 million. But under Miles' leadership, that deficit has expanded to $285
million. And yet the district has cut maintenance staff. One consequence of that irresponsible staff
reduction occurred at Fireland Middle School on Friday, August 16th. During dismissal, a large tree
branch fell off of a dead tree, striking a parent and hospitalizing her. Meanwhile, during the fifth
week of classes, many campuses still struggle with underperforming air conditioning because there
are not enough maintenance staff nor third party vendors to make repairs.

[01:28:30–01:29:00]
Board of managers, please engage a third party to perform comprehensive audits of HIC's finances
under Maza's tenure. No transparency, no trust, no bond. Thank you. Dr. Adita Wadwall, you may
begin. Well, I don't know exactly what happened at Marshall Middle School. I know that the reported
lack of a working AED is emblematic of the lapse of services happening under the leadership of Mike,
Audrey, Rick, Angie, Cassandra, Michelle, Jeanette, Rolando, Paula, and Adam.

[01:29:00–01:29:30]
you have removed the dignity of parents and students and your zeal to improve tests. I've watched a
seven year old cry in front of you because she misses her library. And what was your response?
Nothing. Not every campus to you is worthy of a nurse in your staffing model, and not every campus
is worth having books. Books, y'all. Books. It's 2024, and I'm having to defend books to a board of
people of color and patent, no trust, no pun.",0
45,1:30:00,1:32:00,"[01:30:00–01:30:30]
Okay. Jessica Catcher, please turn your camera on. You may begin. Does she know she's on? Ma'am,
you're on camera and we're ready to hear from you. Me? Yes. Jessica Catrice. Yes, ma'am.

[01:30:30–01:31:00]
Jessica Catherine, HIST parent. I'm reading a statement on behalf of a former Wainwright Elementary
parent who could not be here tonight. My name is Rosa Strawn. Last year, my son attended our zone
school, Wainwright Elementary. We toured the school the year before and were pleased with the things
we saw on tour. Then Mr. F. Mike Miles came and things changed drastically. Wainwright was now in ES
Align. Upon registering, I requested my son to be placed in dual language programs. At me's teacher,
I was told that he had not been placed in that program. In my 19 years of teaching, I had never seen

[01:31:00–01:31:30]
such disrespect for the whole child as I saw Wayne Wright at Wayne Wright. Worksheets, worksheets
were sent home. No hand-on learning opportunities, no library program. The only art the children did
was coloring sheets. HISC needs better. No trust, no bonds. Dr. Benzon, you may begin. Hi, my name
is Maria Benzon. Today, Mr. Miles is going to highlight the remarkable results in student
performance across reading math.

[01:31:30–01:32:00]
and career readiness assessments under his administration. However, I have serious concerns. First,
there is a lack of transparency. Numerators and denominators aren't reported. Second, terms like
percent and percentage point increases are used incorrectly despite being very different. Third,
some reported gains exceeded 400% over just a couple of years, which is highly questionable. Given
the context, such as HISD's declining school enrollments, a mass exodus of teachers and principals,
and an alarming rise.",0
46,1:32:00,1:34:00,"[01:32:00–01:32:30]
in uncertified teachers, one has to wonder if these numbers are manipulated. Is this really
education or simply business? At what cost are we chasing these metrics, risking student well being
and community stability? On November 5th, vote no on propositions A and B. No trust, no
transparency, no bond. That concludes our speakers. Thank you.

[01:32:30–01:33:00]
All right. Thank you to everyone who came to speak this evening and those who are on Zoom. We will
now address our discussion and report items. And I believe the first item that we are going to look
at this evening is the acceptance of board monitoring update goals three and four. And also after
that, Superintendent, are you doing the you're doing the presentation also on the constraints as
well? Yes, ma'am. And then as part of that, you're going to talk about teacher effectiveness and
retention. Right. I was going to start with that.

[01:33:00–01:33:30]
I think it's all isn't it it's all tied to the goals. Yes, that's fine. Okay, and so just um as
you're moving, I'll just remind the board that as we hear the presentations on the um monitoring
updates, and there are two separate ones that we are going to have before us this evening. The issue
is whether um first the goal was clearly um shown, described in the document. The data, the second
item is whether the data clearly shows for the three pre previous reporting periods and the current.",0
